"duongtb.vms@gmail.com","Sat","9.88039778481e-07","0.00466395599139","-0.4","RT GAME X 200 000 000 GMX AIRDROP CONDITION FOLLOW RETWEET LIKE COMMENT YOUR ERC 20 eth btcm crypto payment topbtc"
"Elleok","Tue","0.00117181517728","0.0","-0.25","Small Decrease Today A Market Analysis crypto cryptocurrency cryptocurrencies"
"Joda Walter","Mon","0.000151170086108","0.100095670892","0.2","RT Annual Economic Costs Banking 1 870B Gold Mining 105B Banking Electricity 63 8B Gold Recycling 40B Paper"
"Omar Ayyash (#TraXionICO)","Sun","0.0101135751725","0.17878497967","0.025000000000000005","RT Colorado wants to allow political donations in bitcoin and other cryptocurrency Impressio bi"
"Colette Grail","Sat","0.0156406696934","0.0","0.0","How can the USNavy start using blockchain bitcoin and smartcontracts"
"Tony tweeeet","Fri","4.24857104747e-05","0.00621860798852","0.6","RT Putin Cryptocurrency Has Its Place No State Can Have Own Crypto Bitcoin"
"Iota News","Thu","0.000293447814209","0.000119588615164","0.0625","RT Six Major Banks in Chile Sued by Another Cryptocurrency Exchange BTC ETH XRP BCH LTC NE"
"Emescolala Davidson","Wed","0.000278627217532","0.000597943075819","0.25","RT RECEIVE 111 111 ADVERT TOKENS IN OUR FIRST EVER AIRDROP airdrop bounty freetoken bitcoin"
"Наташа Королева","Tue","2.27249149051e-05","0.00275053814877","-0.05","RT Venezuelan Government has issued an official statement eliminating obstacles to the import of mining equipment crypto"
"Marie","Mon","0.00161445699804","0.0","0.0","Do u want to buy some bitcoin Read this 1st YW cryptocurrency BTC btcusd crypto BTC HODL ico altcoin"
"Erina Gremory","Sun","0.000613572702437","0.00574025352786","-0.4","RT GAME X 200 000 000 GMX AIRDROP CONDITION FOLLOW RETWEET LIKE COMMENT YOUR ERC 20 eth btcm crypto payment topbtc"
"Наташа Королева","Sat","2.27249149051e-05","0.00334848122459","0.0","RT Cryptcurrency bitcoin ethereum Ripple ICOs cryptocurrency"
"Crypto Airdrops","Fri","0.000415964746741","0.000239177230328","0.0","RT Bitcoin Satoshi Earn Money cryptocurrency blockchain Airdrop Click Sign Up and Create a Wallet"
"Javier Luis Pidone","Thu","0.000119552813196","0.00143506338197","-0.1","RT 12 guidelines to design green cities of the future via IIoT IoE AI BitCoin CryptoCurrency startup smallb"
"Chiemela Nwagbara","Wed","1.28445171203e-05","0.15725902894","0.06818181818181818","RT Check out our new airdrop campaign We re giving a total of 3000 PO8 24 per user"
"Crypto Airdrops","Tue","0.000182787359019","0.000597943075819","0.13636363636363635","RT Bitcoin Satoshi cryptocurrency blockchain Airdrop NEW AIRDROP 5 5 stars PokemonGo Decentralized"
"CoinNuts","Mon","0.00114711418282","0.0","0.0","News from CCN Opinion The Future of ICOs and the Potential of Securities Token Offerings"
"André","Sun","0.000289495655095","0.00287012676393","0.25","RT Follow the hashrate The hashrate keeps going higher Price always follows hashrate Every currency in the world is cras"
"Bounty","Sat","0.00418039630276","0.0265486725664","0.21666666666666665","RT Paymaz ecosystem will have a crypto exchange a universal wallet B2B and B2C payment gateways and a strong POS network to he"
"Steven Zheng","Fri","0.000429797303639","0.0","0.0","Bitcoin is a better crypto collectible than cryptokitties"
"AD","Thu","1.77847160127e-05","0.00621860798852","0.6","RT Putin Cryptocurrency Has Its Place No State Can Have Own Crypto Bitcoin"
"BitHound","Wed","0.000122516932532","0.0","0.0","Current price of Bitcoin is 7646 82 Bitcoin Bithound"
"Max Keiser","Tue","0.221699329615","0.00287012676393","0.25","RT Follow the hashrate The hashrate keeps going higher Price always follows hashrate Every currency in the world is cras"
"Jakmati","Mon","2.56890342405e-05","0.100095670892","0.2","RT Annual Economic Costs Banking 1 870B Gold Mining 105B Banking Electricity 63 8B Gold Recycling 40B Paper"
"ひろこさん。","Sun","0.000281591336867","0.00813202583114","0.15000000000000002","RT I will choose 20 random followers to win 0 2 ETH Please 1 FOLLOW 2 LIKE AND RETWEET 3 Comment your ETH address aird"
"Social Start Now","Sat","1.0","0.0","0.0","The Infinity Futures Sierra Charting Club wsj nytimes reuters"
"Altcoinator","Fri","0.000441653780981","0.000119588615164","0.0625","Six Major Banks in Chile Sued by Another Cryptocurrency Exchange BTC ETH XRP BCH LTC"
"Craig Sobey","Thu","0.0229630324917","0.000239177230328","0.0","RT How Can This Be Happening on Our Planet And Media Doesn t Report It grandsolarminimum"
"Rodney Tambling","Wed","4.64378695886e-05","0.00215259507295","0.2","RT I am a long term customer and I see you accept Bitcoin Verge Currency is becoming mainstream and ha"
"André","Tue","0.000289495655095","0.00621860798852","0.0","RT The urge for humans to mine Bitcoin as the difficulty rises is irresistible and will never stop not even after every fiat"
"Crypto Carabao","Mon","6.42225856013e-05","0.100095670892","0.2","RT Annual Economic Costs Banking 1 870B Gold Mining 105B Banking Electricity 63 8B Gold Recycling 40B Paper"
"Pantera Capital","Sun","0.033545926559","0.000717531690983","0.0","RT What does the future hold for bitcoin and blockchain technology will educate you The CEO of"
"CryptoGodzilla","Sat","0.00459734908927","0.000478354460655","0.6","RT and the team thrilled to be partnering with the father of with the Palazzetto property auct"
"Marry Sueberg","Fri","0.00318445220605","0.000597943075819","0.4","RT For Every 25 000 x 100 2 500 000 FREE Tokens that I GiveAway I am rewarded with 1 000 000 000 Tokens ALL are Wi"
"$700,000 USD Future Crypto value","Thu","0.0663794764377","0.000597943075819","0.4","For Every 25 000 x 100 2 500 000 FREE Tokens that I GiveAway I am rewarded with 1 000 000 000 Tokens ALL a"
"Crypto Airdrops","Wed","0.000415964746741","0.000478354460655","0.13636363636363635","RT Bitcoin Satoshi cryptocurrency blockchain Airdrop New Airdrop Swift Swiftdemand is airdroping 100 Swift by Sig"
"ECE UYSAL","Tue","0.00125085835956","0.0271466156422","0.0","RT While you trade on the Exchange your holdings will sync with your Coinnup Wallet automatically cryptocurrency bi"
"Amir Mido","Mon","0.0109128993533","0.0","0.29166666666666663","GlobalREIT This Company have a ambitious idea I hope the project will adequately reward the participants of the b"
"Mohamed Sadek","Sun","2.96411933544e-06","0.999880411385","0.25","RT Onasander Airdrop 3 000 give away every week First Investment Bank running on Blockchain Go to Airdrop Page https"
"Fran Paredes","Sat","0.000281591336867","0.00621860798852","0.0","RT The urge for humans to mine Bitcoin as the difficulty rises is irresistible and will never stop not even after every fiat"
"coinOK","Fri","0.008586065675","0.0","0.0","The Hardware Bitcoin Wallet Get Trezor now for only 89 EUR btc bitcoin 18"
"Crypto Airdrops","Thu","0.000182787359019","0.000358765845492","0.13636363636363635","RT Bitcoin cryptocurrency Airdrop New Airdrop Superbloom Earn 1 000 Tokens 500 Airdrop of 10 000 000 Superbloo"
"Crypto News: C-NEWS","Wed","0.000239105626393","0.0","0.0","Tech Blog Russian Banker Turned Anarchist Farmer is Turning Potatoes into Crypto"
"Wohan X","Tue","2.37129546836e-05","0.000119588615164","0.7","RT Be disruptive and adopt cryptocurrencies Push for a fair currency that canno"
"Amedeo","Mon","2.8653153576e-05","0.000239177230328","0.0","Price prediction for BANKERA BNK end of year bitcoin criptovalute WWDC18 Russia2018WorldCup 2k18"
"eli","Sun","0.00223889813804","0.00585984214303","-0.4","RT GAME X 200 000 000 GMX AIRDROP CONDITION FOLLOW RETWEET LIKE COMMENT YOUR ERC 20 eth btcm crypto payment topbtc"
"Banty","Sat","0.000623453100222","0.0271466156422","0.25","RT 1 Million DENT users achieved 3 weeks before the deadline on our Roadmap Thank you for your support during our first year fo"
"Ramanpreet Singh","Fri","0.000179823239684","0.100095670892","0.2","RT Annual Economic Costs Banking 1 870B Gold Mining 105B Banking Electricity 63 8B Gold Recycling 40B Paper"
"xBanagher","Thu","0.00016895480212","0.00215259507295","0.0","RT XRP price in year 2023 Vote based on function and info not when lambo Ripple xrp crypto bitcoin ethereum"
"Ben lockett","Wed","3.85335513608e-05","0.100095670892","0.2","RT Annual Economic Costs Banking 1 870B Gold Mining 105B Banking Electricity 63 8B Gold Recycling 40B Paper"
"Halim Shaikh","Tue","3.65574718038e-05","0.000239177230328","0.0","RT Cryptocurrency Will Become a 20 Trillion Market Billionaire Bull Mike Novogratz BTC Bitcoin B"
"₿it Minute","Mon","2.96411933544e-05","0.0","0.0","LTC would have made the biggest dent in your digital wallet if you invested in it a year ago Here s the"
"Crypto Daku","Sun","0.000181799319241","0.0","0.2","Be careful who you follow and be even more selective when choosing what to invest in or trade Always use stop loss"
"bang's","Sat","0.000413000627405","0.0387467113131","0.1","RT The surety airdrop is here receive up to 400 in surety tokens Sign up and complete the airdrop procedure to receive you"
"MR. BLOCKCHAIN","Fri","0.00939823437292","0.0351590528582","0.0","RT EXCLUSIVE AIRDROP We decided to give 100 000 CALL amp 20 000 000 CALLG to our supporters If you want to join follow t"
"Scott Howard","Thu","0.00195039052272","0.000358765845492","0.3666666666666667","RT How to make better sense on the current state of crypto let s assemble as its own periodic table in this moment of ti"
"Rommy","Wed","0.000141289688323","0.0099258550586","0.15000000000000002","RT 10 random followers to win 0 05 ETH 1 FOLLOW 2 LIKE AND RETWEET 4 SUBSCRIBE 3 Comment ETH"
"Matthew G.","Tue","7.90431822785e-06","0.0181774695049","0.1","RT HouseAfrica is not just an idea HouseAfrica is a working project ready for the public A peek at our MVP site Bitcoin"
"Deny K. Setyawan","Mon","0.00269833663503","0.0","-0.3","Buy now before late WankCoin ethereum bitcoin litecoin cryptocurrency blockchain"
"BletherinScotsman-#Justice4Reality#ReconnectJulian","Sun","0.00171029685655","0.00621860798852","0.0","RT The urge for humans to mine Bitcoin as the difficulty rises is irresistible and will never stop not even after every fiat"
"AltCoynz","Sat","3.16172729114e-05","0.000239177230328","0.5","RT Top 5 most upcoming events 1 tron 10 events 2 bitcoin 4 events 3 bytecoin bcn 3 events 4 waltonch"
"Binmap","Fri","2.6677074019e-05","0.000597943075819","0.7","RT My Grab driver in Vietnam just tried to shill me Bitcoin Is this a good sign"
"Crypto Airdrops","Thu","0.000415964746741","0.000239177230328","0.13636363636363635","RT Bitcoin Satoshi Earn Money cryptocurrency blockchain Airdrop New Airdrop SANCOJ Earn 9000 SANC Token by Sign"
"mohammed khalil","Wed","0.00029937605288","0.00215259507295","-0.1326388888888889","RT Bitcoin is going to make a BIG break up or down soon Here s what to do Buy a little bit now at 7 600 Buy a little"
"Future Tech Podcast","Tue","0.0010651068812","0.0","0.0","Your Home For Bitcoin Blockchain Ethereum amp Fintech News amp Information Listen to"
"Vikram Ramakrishnan","Mon","8.69475005064e-05","0.0682850992586","0.3","RT Bitcoin is by far the most energy efficient monetary system we ve ever designed"
"Crypto Airdrops","Sun","0.000182787359019","0.000597943075819","0.19318181818181818","RT Bitcoin cryptocurrency Airdrop New Airdrop CREED ICOcreed Airdrop 2000 CREED Tokens to the first 1 000 partic"
"World Seeker","Sat","3.55694320253e-05","0.0","0.13636363636363635","Crypto Millionaire Master Plan Homeless New Pair Of Shoes via bitcoin"
"TMT","Fri","3.65574718038e-05","0.000119588615164","0.4611111111111111","RT Repost Let me just check that quick Happy Friday TaxToken memes cryptomemes funny"
"Crypto Carabao","Thu","6.42225856013e-05","0.0","0.0","Decentralize for liberty from GovernmentGangsters Bitcoin bisq"
"Alvian Syah Putra","Wed","6.91627844937e-06","0.282109543171","0.5","RT Get More Tokens Send a minimum of 0 001ETH to 0xd506e5e57e22c695bf28c96e73c296051177a678 and get 444 444 tokens The more yo"
"Todo En PC 2.0","Tue","0.00365377110082","0.0517818703659","0.0","RT Director of Business Development did some video work today Big things coming from Viva Fintech Financ"
"ICOchecker.com","Mon","0.0107854422219","0.0271466156422","0.0","RT While you trade on the Exchange your holdings will sync with your Coinnup Wallet automatically cryptocurrency bi"
"Adam Sarwar","Sun","0.0212171662031","0.00621860798852","0.0","RT The urge for humans to mine Bitcoin as the difficulty rises is irresistible and will never stop not even after every fiat"
"mohammed khalil","Sat","0.00029937605288","0.00322889260942","0.0","RT RT Cryptocurrencies These are replacements for sovereign currencies replace the dollar the euro the yen with"
"Anto","Fri","0.00036458667826","0.0","0.25","Bitcoin Ethereum Ripple Bitcoin Cash EOS Litecoin Cardano Stellar IOTA Price Analysis June 08"
"ICOchecker.com","Thu","0.0107854422219","0.0013154747668","0.12878787878787878","RT For those that are interested in crypto currency There s a new ICO Initial Coin Offering that helps cryptocurrency fundin"
"Mora Sky","Wed","0.00595096358579","0.0013154747668","0.12878787878787878","RT For those that are interested in crypto currency There s a new ICO Initial Coin Offering that helps cryptocurrency fundin"
"SnowsCrypt","Tue","0.000346801962247","0.00502272183688","0.13636363636363635","RT bitcoin scalping trendline Break of the up trend line will move the focus to the new channel being formed Hold of th"
"David Aketch","Mon","0.003113313342","0.00621860798852","0.0","RT The urge for humans to mine Bitcoin as the difficulty rises is irresistible and will never stop not even after every fiat"
"Minh Vuong","Sun","0.000338897644019","0.00932791198278","0.25","RT BREAKING No illegal activity South Korea s largest Bithumb Cryptocurrency Exchange approved by the Government"
"misha14082010","Sat","0.00237129546836","0.0233197799569","0.0","RT Our group in China Shanghai preparing for next conferences Cryptocurrecy blockchaintechnology"
"Daniel Macaulay","Fri","0.000258866421962","0.0013154747668","0.12878787878787878","RT For those that are interested in crypto currency There s a new ICO Initial Coin Offering that helps cryptocurrency fundin"
"Ece Onder","Thu","0.00110858063146","0.0271466156422","0.0","RT While you trade on the Exchange your holdings will sync with your Coinnup Wallet automatically cryptocurrency bi"
"misha14082010","Wed","0.00237129546836","0.0141114565893","0.15555555555555556","RT To all social media Influencers out there now is your big chance to start making easy money in Cryprtocurrency Cryptocurr"
"Zakiya Aini","Tue","1.87727557911e-05","0.282109543171","0.5","RT Get More Tokens Send a minimum of 0 001ETH to 0xd506e5e57e22c695bf28c96e73c296051177a678 and get 444 444 tokens The more yo"
"Stan","Mon","0.02221212226","0.0","0.21428571428571427","Step by Step Guide What the heck is a Smart Contract blockchain bitcoin ethereum"
"Daniel Macaulay","Sun","0.000258866421962","0.00621860798852","0.6","RT Putin Cryptocurrency Has Its Place No State Can Have Own Crypto Bitcoin"
"Airdropking","Sat","0.00018871559769","0.000239177230328","-0.005555555555555554","RT Token Center Dog Watch Report 1 1 1 Billion Stolen In Cryptocurrency In First Half Of 2018 2 Vietnam Proposes Ban O"
"ShadeCloud","Fri","0.000167966762342","0.0487921549868","0.0","RT We did it 2 Atomic Swap on Lightning between BTC amp LTC Kudos to from pioneering this Who is 3"
"Jose Arteaga","Thu","0.000321112928006","0.00334848122459","0.2857142857142857","RT When I started buying Bitcoin at 3 in 2011 told me to wait She was right She started buying at 1"
"Marina Isaeva","Wed","0.0108447246086","0.0220043051901","0.6000000000000001","RT The Beta version of Qurrex amazing trading platform is already online at TokenSale bitcoin crypto"
"John","Tue","0.000125481051867","0.0","0.0","Neither Roger Ver nor Craig Wright nor Brad Garlinghouse Charlie Lee Vitalik Buterin Alan Greenspan Janet Yel"
"Egon ⚡️Bitcoin (BCH)⚡️","Mon","0.00870166632909","0.000239177230328","0.0","Why Destroyed Bitcoin retweet to pomote your porfolio"
"Domain 10K","Sun","0.000777587305665","0.000239177230328","0.4666666666666666","RT Excellent Domain Name looking for Genuine buyer only Hurry buy it now before someone else does"
"Crypto Airdrops","Sat","0.000415964746741","0.000119588615164","0.13636363636363635","RT Bitcoin Satoshi Earn Money cryptocurrency blockchain Airdrop New Airdrop ArawToken ArawToken Airdrop 500 ARAW"
"Crypto Airdrops","Fri","0.000182787359019","0.000358765845492","0.13636363636363635","RT Bitcoin Satoshi Earn Money cryptocurrency blockchain Airdrop New Airdrop SANCOJ Earn 9000 SANC Token by Si"
"Dan H.","Thu","0.000472283014114","0.00322889260942","0.10880681818181817","RT Dropped a new article this morning This is a new style of content that I m testing out Here s a cool little PDF"
"CHDftyl [Segwit+⚡️]","Wed","0.000155122245222","0.00346806983975","0.5","RT Three weeks ago we launched LightningNetwork payments on our test shop Now with more than 500"
"Achmad Abdurrohim","Tue","9.38637789557e-05","0.271466156422","0.0","RT 444Million Token Airdrop Starts Join Now Airdrop freetoken freecoin erc20 ethereum eth eth"
"mohammed khalil","Mon","0.00029937605288","0.00167424061229","0.0","RT A token a digital asset where I give you my money and you go off and make a venture and in return for giving you my mo"
"Varun Sehgal","Sun","3.55694320253e-05","0.0","0.25","Get educated with our first Crypto 101 feature What is Bitcoin Bitcoin Crypto Cryptocurrency"
"Shaimaranbir","Sat","3.16172729114e-05","0.282229131787","0.5","RT Get More Tokens Send a minimum of 0 001ETH to 0xd506e5e57e22c695bf28c96e73c296051177a678 and get 444 444 tokens The more yo"
"NeatlyWiseNuts","Fri","1.87727557911e-05","0.0148289882803","-0.09999999999999999","RT Three apartments in the residential complex Dukley Gardens in Montenegro were sold for 420 Bitcoins to a 25 year old"
"toby","Thu","6.02704264874e-05","0.890337239895","0.0","RT We are airdropping 100 LightningNet LNET Follow us join our telegram and retweet this t"
"Mamedkuli","Wed","0.000112636534747","0.00275053814877","-0.05","RT Venezuelan Government has issued an official statement eliminating obstacles to the import of mining equipment crypto"
"BIM ARCH SERVICES","Tue","0.000939625829336","0.00621860798852","0.0","RT The urge for humans to mine Bitcoin as the difficulty rises is irresistible and will never stop not even after every fiat"
"Erghim Baloshi","Mon","0.00336625152529","0.271585745037","0.0","RT 444Million Token Airdrop Starts Join Now Airdrop freetoken freecoin erc20 ethereum eth eth"
"Toriola Olaniyi ","Sun","0.000826989294589","0.00215259507295","0.0","RT Those who use the Yield stablecoin pay fees to those who process transactions within the BlockVest Decentralized Exchan"
"Achmad Abdurrohim","Sat","9.38637789557e-05","0.282348720402","0.5","RT Get More Tokens Send a minimum of 0 001ETH to 0xd506e5e57e22c695bf28c96e73c296051177a678 and get 444 444 tokens The more yo"
"Andres Carceller 😃 ₿ 🚀★","Fri","0.00725221197405","0.0259507294906","0.125","RT First ever cross chain atomic swap executed between bitcoin and litecoin using lightning LightningNetwork"
"Kak Midah","Thu","0.0050508593476","0.0","-0.1","Bitcoin Japanese Syndicate Wallet Hacked 10 Million Reported Missing cryptocurrency hackers"
"Marquez Comelab","Wed","0.000355694320253","0.0","-0.041666666666666664","Finally Some actual numbers to compare the costs of Bitcoin to other monetary systems used This is an answer to"
"Growth48","Tue","0.00125777463801","0.0","0.5","How To Keep Your Cryptocurrency Safe 7 Must Have Wallets Bitcoin Ethereum"
"CHDftyl [Segwit+⚡️]","Mon","0.000155122245222","0.0682850992586","0.3","RT Bitcoin is by far the most energy efficient monetary system we ve ever designed"
"👻Achwaq Khalid.dll👁","Sun","0.00166385898696","0.0487921549868","0.0","RT We did it 2 Atomic Swap on Lightning between BTC amp LTC Kudos to from pioneering this Who is 3"
"Adam Sarwar","Sat","0.0212171662031","0.100095670892","0.2","RT Annual Economic Costs Banking 1 870B Gold Mining 105B Banking Electricity 63 8B Gold Recycling 40B Paper"
"SirCryptsalot","Fri","0.000103744176741","0.0249940205692","0.25","RT Switzerland Shows the Way Bank First to Offer Crypto Business Accounts Bitcoin"
"Azizi Azwah","Thu","2.96411933544e-06","0.282348720402","0.5","RT Get More Tokens Send a minimum of 0 001ETH to 0xd506e5e57e22c695bf28c96e73c296051177a678 and get 444 444 tokens The more yo"
"Bati","Wed","0.00510421349564","0.0524994020569","0.2","RT Did you know that Qurrex is much faster than Binance Poloniex Upbit Bitfinex Bittrex Bitstamp Kraken Bithumb GDAX Co"
"Crypto Town","Tue","0.00105325040386","0.0","-0.1","Bitcoinist SEC Underwhelmed by Lack of Enthusiasm for Regulation Ethereum ETH Ripple XRP bitcoin ripple"
"Crypto Town","Mon","0.00105325040386","0.0","0.0","Cointelegraph Bitcoin Ethereum Ripple Bitcoin Cash EOS Litecoin Card Bitcoin BTC Ethereum ETH"
"Twit Markets","Sun","0.0057118579594","0.0","0.0","W 94 Antminer PSU Mining Power Supply For Bitcoin BTC Miner S9 S7 L3 D3 XP"
"Cryptopatamus [You give me your ETH]","Sat","0.000528601281488","0.00621860798852","0.0","RT The urge for humans to mine Bitcoin as the difficulty rises is irresistible and will never stop not even after every fiat"
"Mamedkuli","Fri","0.000112636534747","0.00334848122459","0.0","RT Cryptcurrency bitcoin ethereum Ripple ICOs cryptocurrency"
"Bitcoin Mate","Thu","0.00237623566725","0.0","0.3","Bitcoin store looking golden in the Costa Del Sol Spain btc"
"The Laughing Man","Wed","0.00105720256298","0.00585984214303","0.3","RT Let s be honest 99 of us wouldn t give two shits about the financial sector if it wasn t for bitcoin"
"Crypto Airdrops","Tue","0.000415964746741","0.000119588615164","0.13636363636363635","RT Bitcoin Satoshi Earn Money cryptocurrency blockchain Airdrop New Airdrop CoTrader CoTrader is airdropping 5 00"
"BrandGodot","Mon","0.000423869064969","0.0","0.4","Click for 10 in Free Bitcoin gt gt investor Promo btc ethereum eth crypto"
"P.","Sun","1.97607955696e-05","0.00334848122459","0.2857142857142857","RT When I started buying Bitcoin at 3 in 2011 told me to wait She was right She started buying at 1"
"Crypto Airdrops","Sat","0.000182787359019","0.000478354460655","0.13636363636363635","RT Bitcoin cryptocurrency Airdrop New Airdrop NextPakk NextPakk airdrop 300 PAKKA 100 USD to the Community Me"
"The Laughing Man","Fri","0.00105720256298","0.00621860798852","0.0","RT The urge for humans to mine Bitcoin as the difficulty rises is irresistible and will never stop not even after every fiat"
"Erghim Baloshi","Thu","0.00336625152529","0.282348720402","0.5","RT Get More Tokens Send a minimum of 0 001ETH to 0xd506e5e57e22c695bf28c96e73c296051177a678 and get 444 444 tokens The more yo"
"Cemre Ayhan","Wed","0.00119552813196","0.0271466156422","0.0","RT While you trade on the Exchange your holdings will sync with your Coinnup Wallet automatically cryptocurrency bi"
"HODLTHIS","Tue","0.000167966762342","0.0175795264291","0.0","RT When bitcoin was 1 000 people dreamt of 7 000 BTC When bitcoin was 15 000 people dreamt of buying 7 000 BTC Now we"
"Mert yaşar","Mon","4.94019889241e-05","0.0142310452045","-0.3603174603174603","RT Are you sick amp tired of social media companies sharing your data without permission Viewo respects your privacy ht"
"JTC","Sun","9.28757391773e-05","0.0013154747668","0.12878787878787878","RT For those that are interested in crypto currency There s a new ICO Initial Coin Offering that helps cryptocurrency fundin"
"Mert yaşar","Sat","4.94019889241e-05","0.00538148768237","0.0","RT Our project is picking up speed to the MOON Here s a newspaper article about Private sale"
"cryptonite","Fri","5.23661082595e-05","0.0200908873475","0.13636363636363635","RT Cryptocurrency ban in China will soon be lifted President Xi Jinping thinks blockchain is a part of the new industri"
"Jamie","Thu","0.000126469091646","0.000478354460655","0.2","RT The world s most powerful supercomputer AI IoT digital Robotics Robot DigitalTransformation future technolo"
"Singularitybooks","Wed","0.00115600654082","0.000119588615164","0.0","RT Joke We like blockchain just not bitcoin Woke We like ripple just not xrp"
"Justin Dart ""The #Bitcoin Guy""","Tue","0.0093023945144","0.0","0.0","Calling all bull time star take over the bitcoin market"
"Ahmed EL-Mutasim","Mon","0.00380988138582","0.00837120306147","0.0","RT The Bitcoin Landscape via bitcoin BTC blockchain Mining Service"
"Lorenzo Bonardi","Sun","6.91627844937e-05","0.00239177230328","0.0","RT Chinese Cryptomining Chip Giant Bitmain Is Considering an IPO mining bitcoin blockchain fi"
"David","Sat","7.80551425e-05","0.000956708921311","0.0","RT BALLZ TO THE WALL 67 of 100DaysofSatoshiDoodles Bitcoin BitcoinCash BitcoinNotBombs"
"Matthias Reder","Fri","3.85335513608e-05","0.0682850992586","0.3","RT Bitcoin is by far the most energy efficient monetary system we ve ever designed"
"Bobman","Thu","1.97607955696e-05","0.282348720402","0.5","RT Get More Tokens Send a minimum of 0 001ETH to 0xd506e5e57e22c695bf28c96e73c296051177a678 and get 444 444 tokens The more yo"
"Bitcoin cash trumps BCH [BCH/BCC/XBC]","Wed","0.00315678709225","0.0","0.0","I just saved 4 36 by shopping bitcoin amazon shopping"
"Ohio Bitcoin","Tue","0.0198487311099","0.0","-0.4","Bitmain Doesn t Have a Secret Crypto Mining Operation Jihan Wu bitcoin bitcoinprice BTCtoUSD btcprice"
"Brian Su","Mon","0.0011293294668","0.000119588615164","0.25","RT We love bitcoin and blockchain Check out our blog on all things China and crypto as we are currently traveling thro"
