"duongtb.vms@gmail.com","Sat","9.88039778481e-07","0.00466395599139","-0.4","RT GAME X 200 000 000 GMX AIRDROP CONDITION FOLLOW RETWEET LIKE COMMENT YOUR ERC 20 eth btcm crypto payment topbtc"
"Milanobass","Fri","0.000236141507057","0.000119588615164","0.0","RT Contrct address 0x531d89649690f570347aea8eba1461b640c1346e SYM btcforce Decimal 18 Add to your myetherwallet account be"
"Milanobass","Thu","0.000236141507057","0.000119588615164","0.08333333333333333","RT 50000000 Coin in first round of ICO from 11th June Be ready to get bonus on your purchase btcforce crypto bitcoin ether"
"cryptocurrency_nooze","Wed","4.34737502532e-05","0.000597943075819","0.0642857142857143","RT Steve Wozniak Wants Bitcoin to Become the World s Single Currency newsoftheweek Bitcoin b"
"Joseph Knoff","Tue","0.000115600654082","0.0484333891414","0.0","RT We did it 2 Atomic Swap on Lightning between BTC amp LTC Kudos to from pioneering this Who is 3"
"Earn Money Online Opportunity","Mon","0.000596776026203","0.00107629753647","0.2681818181818182","RT Bitcoin Satoshi Earn Money cryptocurrency blockchain Airdrop New Airdrop LBA Libra Credit Get free LBA Tokens"
"Diego ""Not giving away Crypto"" Gutierrez-Zaldivar","Sun","0.0161663068555","0.000239177230328","0.25","RT Once again banks in Colombia and elsewhere acting as de facto enforcers of mostly non existing regulation with zero a"
"kuroshirorupan","Sat","0.000282579376646","0.00322889260942","0.0","RT 100 DHP Token FINAL AirDrop ONLY 7 DAYS LEFT SALE BEGINS JUNE 16th ERC20 TokenSale Airdrop ethereum ICO cry"
"Crypsi","Fri","0.00110561651212","0.00729490552499","0.0","RT bitcoin Ride the Lightning Network"
"Milanobass","Thu","0.000236141507057","0.000239177230328","0.0","RT details are here btcforce crypto bitcoin ethereum ICO token litecoin cryptocurrency Bitcointalk altcoins Altcoins"
"jyoti anand","Wed","0.0106490927325","0.0348002870127","0.0","RT EXCLUSIVE AIRDROP We decided to give 100 000 CALL amp 20 000 000 CALLG to our supporters If you want to join follow t"
"Coach Nesto","Tue","0.000778575345443","0.0","0.0","Stats mo blockchain crypto bitcoin"
"Nikita Shvachunov","Mon","0.0135588698801","0.0309734513274","0.0","RT We are waiting for you as our project partner buy our tokens here Don t forget to join our"
"nghien","Sun","9.88039778481e-07","0.0056206649127","0.0","RT Hello bountyhunters Wanna earn up to 50 000 Tokens Follow us Retweet amp Like our posts Comment your ETC Fill in ht"
"Xxx Coin","Sat","0.00446989195785","0.278521884717","0.5","RT Get More Tokens Send a minimum of 0 001ETH to 0xd506e5e57e22c695bf28c96e73c296051177a678 and get 444 444 tokens The more yo"
"The Invisible Podcaster","Fri","0.00173697393057","0.000119588615164","0.0","RT Counting his Bitcoin"
"Ethereum Classic🚀","Thu","0.0157651627055","0.000358765845492","0.0","RT of at Blockchain Korea Conference 2018 about EthereumClassic SmartContracts Robotics Inte"
"TheCryptoNews","Wed","0.000196619915918","0.0","0.5333333333333333","Do you want the best daily niche and popular Crypto News Follow us Retweet us cryptocurrency bitcoin"
"Budhi Kesuma","Tue","0.0036458667826","0.00370724707008","-0.5","RT Unfortunately centralized platforms like the App and Google Play store monopolize the lionshare of the market s audie"
"Global Entrepreneur Summit","Mon","0.0681184264478","0.000239177230328","0.0","Get the insights from our experts about bitcoin blockchain and what you should do about them GES2018 Brisbane"
"Milanobass","Sun","0.000236141507057","0.000239177230328","0.0","RT FOLLOW US FOR ALL UPDATES OF OUR PROJECT btcforce crypto bitcoin ethereum ICO token litecoin cryptocurrency Bitcoin"
"giannis diam","Sat","3.35933524684e-05","0.889260942358","0.0","RT We are airdropping 100 LightningNet LNET Follow us join our telegram and retweet this t"
"#Traxion ian Eldino-JFB Crypto","Fri","0.0124166958962","0.0","0.4666666666666667","An interesting project for you to follow because Bitcoin Owners can easily earn money with the help of moneto wit"
"Kevin Piciulo","Thu","2.56890342405e-05","0.0998564936618","0.2","RT Annual Economic Costs Banking 1 870B Gold Mining 105B Banking Electricity 63 8B Gold Recycling 40B Paper"
"PeerReviewBotter","Wed","0.00201856526744","0.0281033245635","0.0","RT P2PS Review by CryptoOrders by Blockchain Cryptocurrency ethereum bitcoin token TokenSal"
"Jennifer Fernandez","Tue","0.000491055769905","0.0026309495336","0.1","RT Colombia is looking into how blockchain can be applied across administrative economic and political spheres"
"Hooss Kehyou","Mon","2.07488353481e-05","0.278521884717","0.5","RT Get More Tokens Send a minimum of 0 001ETH to 0xd506e5e57e22c695bf28c96e73c296051177a678 and get 444 444 tokens The more yo"
"Jimbe","Sun","9.88039778481e-07","0.889260942358","0.0","RT We are airdropping 100 LightningNet LNET Follow us join our telegram and retweet this t"
"Carl Job","Sat","0.00219740046734","0.0206888304233","0.0","RT Mass adoption of Blockchain based Solutions and cryptocurrencies can reduce transaction fees and third party commissions"
"Astira.vestira","Fri","0.000105720256298","0.000119588615164","0.0","RT One of these scammers trying to hack this account for the 3rd time even if you managed to hack it I ll make another o"
"Bingo 2000","Thu","0.00241081705949","0.0203300645779","0.6","RT P2PS has no comparable substitutes alternatives or parallels Please support P2PS ICO for the greater good of humanity Please"
"SNFB, Inc.","Wed","0.181413983727","0.0","0.0","Get people taking to twitter about your company wsj nytimes reuters bloomberg"
"Get Triggered","Tue","0.000415964746741","0.000478354460655","0.0","RT Finished reading book by Collusion How central bankers rigged the word A story of the 2007 2008 financial"
"J","Mon","0.00140301648544","0.000119588615164","0.0","RT cybersecurity amp bitcoin darkweb deepweb ransomeware cyberwarfare protect yourself"
"Connie Gallippi","Sun","0.0105433724762","0.000239177230328","0.0","RT Four years ago the 2014 Bitcoin Bowling Tournament Featuring"
"Manager5555","Sat","0.000670879009589","0.000119588615164","0.0","RT Bitcoin weekly compression on the 50sma"
"SV","Fri","3.75455115823e-05","0.0484333891414","0.0","RT We did it 2 Atomic Swap on Lightning between BTC amp LTC Kudos to from pioneering this Who is 3"
"Luc3ro","Thu","6.71867049367e-05","0.0484333891414","0.0","RT We did it 2 Atomic Swap on Lightning between BTC amp LTC Kudos to from pioneering this Who is 3"
"WallSt.ForSale","Wed","0.00196422307962","0.0111217412102","0.0","RT Don t miss the opportunity to get IDMoney with a 90 bonus in our pre sale ethereum bitcoin E"
"Morgiana","Tue","0.00895559255216","0.0","0.0","The Trimpo platform is a multifunctional service that meets the needs of several user categories"
"Manuel Hector Galan","Mon","0.00104040588674","0.0086103802918","0.0","RT What are some advantages of Blockchain MT"
"えあろじ","Sun","0.000308268410886","0.278521884717","0.5","RT Get More Tokens Send a minimum of 0 001ETH to 0xd506e5e57e22c695bf28c96e73c296051177a678 and get 444 444 tokens The more yo"
"Supardi Takhir","Sat","2.96411933544e-06","0.278521884717","0.5","RT Get More Tokens Send a minimum of 0 001ETH to 0xd506e5e57e22c695bf28c96e73c296051177a678 and get 444 444 tokens The more yo"
"Julia Edling","Fri","0.00667322066386","0.000239177230328","0.2","RT Cost Analysis for June 8th for Cryptocurrencies At the beginning of the year the analysts were very bullish on Bitcoin"
"matra prima","Thu","0.000586895628418","0.267519732122","0.0","RT 444Million Token Airdrop Starts Join Now Airdrop freetoken freecoin erc20 ethereum eth eth"
"سليم","Wed","0.000104732216519","0.99976082277","0.25","RT Onasander Airdrop 3 000 give away every week First Investment Bank running on Blockchain Go to Airdrop Page https"
"Spawny Crypto","Tue","0.00161248091848","0.0111217412102","0.0","RT Don t miss the opportunity to get IDMoney with a 90 bonus in our pre sale ethereum bitcoin E"
"analyst5","Mon","0.00589168119909","0.0","0.0","XRP 17 660m XEM 17 550m ZEC 14 276m ETH 107 733m BTC 104 197m ADA 22 6"
"Net DirXions Inc.","Sun","0.006391629327","0.0086103802918","0.0","RT What are some advantages of Blockchain MT"
"Matthew J. Shaw","Sat","0.00305897115418","0.000478354460655","0.0","RT Finished reading book by Collusion How central bankers rigged the word A story of the 2007 2008 financial"
"Max","Fri","0.000249974063956","0.00872996890696","0.5","RT THEKEY MVP Testnet Providing Access to Services we need the most THEKEY Nep5 NEO Bigdata"
"えあろじ","Thu","0.000308268410886","0.267519732122","0.0","RT 444Million Token Airdrop Starts Join Now Airdrop freetoken freecoin erc20 ethereum eth eth"
"Djek","Wed","0.00745476012864","0.0","0.13636363636363635","NEW AIRDROP Vanig Get 15 for every task you achieve Up to 100 All informations here"
"Larry 'Coiny' Evans","Tue","0.0188310501381","0.000239177230328","0.2","Cost Analysis for June 8th for Cryptocurrencies At the beginning of the year the analysts were very bullish on"
"AntonioGomez","Mon","0.000402132189842","0.000478354460655","0.5","RT Interesting The Periodic Table Of Cryptocurrencies Daniel Frumkin cryptocurrencies bitcoin tokens protocols platforms"
"Amos Tosin","Sun","6.02704264874e-05","0.278521884717","0.5","RT Get More Tokens Send a minimum of 0 001ETH to 0xd506e5e57e22c695bf28c96e73c296051177a678 and get 444 444 tokens The more yo"
"DejaVu_Crypto","Sat","6.52106253798e-05","0.0","0.3","WelcomeToYourLifePrepareTo either be a slave or create you own future freewill btc crypto bitcoin MAGA"
"Cryptoangel","Fri","0.00387311593165","0.00394642430041","0.0","RT Join our community on Telegram tvrevolution crypto cryptocurrencies bitcoin ethereum block"
"kibaten","Thu","0.000540457758829","0.15725902894","0.06818181818181818","RT Check out our new airdrop campaign We re giving a total of 3000 PO8 24 per user"
"matra prima","Wed","0.000586895628418","0.278521884717","0.5","RT Get More Tokens Send a minimum of 0 001ETH to 0xd506e5e57e22c695bf28c96e73c296051177a678 and get 444 444 tokens The more yo"
"Crypto Doctor Doom","Tue","5.23661082595e-05","0.000239177230328","0.4166666666666667","I don t retweet or group chat but I support these fine humans cryptocurrency bitcoin community btc"
"Achlys Aceline","Mon","0.00745476012864","0.0013154747668","0.125","RT 817M Later LexisNexis Partners With First Institutional Cryptocurrency Exchange Blockbid Thank you for the gre"
"kapo","Sun","0.000597764065981","0.0","0.0","I sell 70 000 of Bitcoin account Send me a DM selling account sellingaccount accountforsale sale sell buy buyaccount"
"elsa uecke","Sat","0.000716328839399","0.027027027027","0.0","RT bountyhunters earn 50 000 Tokens 1 Follow us 2 Retweet amp like ALL our posts 3 Comment with your ETH Address ER"
"Ismail hassan","Fri","8.89235800633e-06","0.278521884717","0.5","RT Get More Tokens Send a minimum of 0 001ETH to 0xd506e5e57e22c695bf28c96e73c296051177a678 and get 444 444 tokens The more yo"
"Dmitry Chernov","Thu","0.0010423819663","0.0541736426692","-0.15","RT OUR PRE SALE RATE OF 0 08 ENDS at Midnight GMT on June 2nd Register before its too late and the price increases to 0 10 pe"
"pumpteamgroup","Wed","0.000191679717025","0.000119588615164","0.0","RT Norwegian Air CEO Launching Bitcoin Exchange May Sell Tickets for Crypto bitcoin bitcoinprice"
"CryptoNewswire 🌐","Tue","0.00925990880393","0.0","0.35000000000000003","Cryptocurrency Scams Becoming More Frequent in India altcoin investing bitcoin"
"Nouse","Mon","0.00281097316978","0.000597943075819","0.8","RT Retweet and Follow to win 1Ethereum bitcoin ethereum Blockchain ICO"
"Nouse","Sun","0.00281097316978","0.0216455393447","0.09999999999999999","RT Hi Decoin Community Our presale stage 2 is open Dtep coin price of 65 for only 14 days We already sold 2 6m worth of dt"
"Yahya","Sat","0.00318840436516","0.00251136091844","0.5","RT Ream more about it at finance blockchain cryptocurrency crowdfunding ICO crypto blockchain b"
"Zad","Fri","0.000127457131424","0.00191341784262","0.05","RT If you like Bitcoin Ethereum Ripple Bitcoincash Litecoin amp EOS they ALREADY had their BIG EPIC gains Then y"
"Eric","Thu","0.00226063501317","0.000239177230328","0.1","RT Developed by and Rafael Pass FruitChain is a blockchain protocol that improves fairness of t"
"Dorman Martin","Wed","0.00446099959984","0.0","0.0","Will Etherium Clobber Bitcoin"
"AMBCrypto","Tue","0.0034482588269","0.000239177230328","0.0","Ontology ONT to launch their MainNet A step towards a stronger pillar BTC ETH ETH"
"samuel Oluwafemi","Mon","2.96411933544e-06","0.278521884717","0.5","RT Get More Tokens Send a minimum of 0 001ETH to 0xd506e5e57e22c695bf28c96e73c296051177a678 and get 444 444 tokens The more yo"
"John Stephen Alaba","Sun","3.06292331329e-05","0.278521884717","0.5","RT Get More Tokens Send a minimum of 0 001ETH to 0xd506e5e57e22c695bf28c96e73c296051177a678 and get 444 444 tokens The more yo"
"Entrepreneur","Sat","0.000306292331329","0.0","0.0","Thailand Trials Central Bank Digital Currency for Interbank Settlement bitcoin blockchain digitalcurrency"
"Larry 'Coiny' Evans","Fri","0.0188310501381","0.000239177230328","-0.028611111111111115","RT Crypto News Bitcoin Loses 7 700 Major Coins Stem More Losses Although crypto markets are still down over the past mon"
"A Gomez","Thu","0.000140301648544","0.000478354460655","0.5","Interesting The Periodic Table Of Cryptocurrencies Daniel Frumkin cryptocurrencies bitcoin tokens protocols"
"Douye","Wed","1.38325568987e-05","0.00514231045204","0.0","RT Check out Parkres press release Bitcoin Parkres Parkresico ethereum cryptocurrency cryptocur"
"Milanobass","Tue","0.000236141507057","0.00597943075819","0.18333333333333335","RT 5000 Token Airdrop to 5 most active followers STEPS 1 LIKE amp FOLLOW 2 RETWEET THIS TWEET amp Tag your max friends before 1"
"JESAMINE SORIAO","Mon","9.88039778481e-06","0.278521884717","0.5","RT Get More Tokens Send a minimum of 0 001ETH to 0xd506e5e57e22c695bf28c96e73c296051177a678 and get 444 444 tokens The more yo"
"Crypto Bitcoin","Sun","0.00159667228203","0.0348002870127","0.0","RT EXCLUSIVE AIRDROP We decided to give 100 000 CALL amp 20 000 000 CALLG to our supporters If you want to join follow t"
"Milanobass","Sat","0.000236141507057","0.000837120306147","0.0","RT Bitcoinforce is community coin so we want representative in every country send us your detail shk1982alld btcforc"
"Viktorija Sidelnikova","Fri","0.00509433309785","0.00227218368811","0.2","RT Let s check out why China is such an important chapter in the Bitcoin saga Read us on Medium"
"Steven Zheng","Thu","0.000429797303639","0.0","0.0","Every bitcoin that is sent to my wallet is taken out of circulation indefinitely hodlgang"
"Milanobass","Wed","0.000236141507057","0.000119588615164","0.012499999999999997","RT Only 2 days left for first round of AIRDROPS Don t miss this opportunity This is a gift from Bitcoinforce btcforce cryp"
"Branches Holland","Tue","0.00372886212399","0.130829944989","-0.15","RT OUR PRE SALE RATE OF 0 08 ENDS at Midnight GMT on June 2nd Register before its too late and the price increases to 0 10 pe"
"BitcoinBrofer","Mon","0.00140104040589","0.0365941162401","-0.15","RT OUR PRE SALE RATE OF 0 08 ENDS at Midnight GMT on June 2nd Register before its too late and the price increases to 0 10 pe"
"elsa uecke","Sun","0.000716328839399","0.0234393685721","0.0","RT Earn 50 000 Tokens How 1 Follow me 2 Retweet amp Like ALL posts 3 Comment with your ETH Address ERC 20 4 Fill t"
"Elaine Shi","Sat","0.00239599646282","0.000239177230328","0.1","RT Developed by and Rafael Pass FruitChain is a blockchain protocol that improves fairness of t"
"Gül Prensi","Fri","0.00168658390187","0.0","0.0","Unites local and international company experts and e commerce services to increase its global sales"
"Synthego","Thu","0.00162137327649","0.000358765845492","0.0","RT Worried about the dropping Bitcoin rate Maybe you would like to invest in NebulaTokens instead by sharing your genomic dat"
"Longhash","Wed","0.000137337529209","0.000239177230328","0.0","Japan aimed to be a Bitcoin capital Then it got hacked Tokyo is no longer a crypto paradise"
"Alvin Javier","Tue","0.00152256929864","0.0248744319541","0.06818181818181818","RT Connect now to Official Telegram Channel for Live updates about Digital Ticks Exchange digitalticksexchange telegram b"
"Airdrop terkini","Mon","0.00062444114","0.0","0.2681818181818182","Get Free 25 Trading Bouns Just Signup New Exchange Bitnymex airdrop bounty Exchange"
"Mad Bitcoins","Sun","0.054031943326","0.000239177230328","0.0","Four years ago the 2014 Bitcoin Bowling Tournament Featuring"
"Felicity Mills","Sat","0.00415174314918","0.00227218368811","0.0","RT The SmartCity BigData Architecture framework IIoT IoE AI CX ML BitCoin CryptoCurrency FinTech startup GrowthHa"
"4thand29","Fri","8.99116198418e-05","0.0271466156422","0.25","RT 1 Million DENT users achieved 3 weeks before the deadline on our Roadmap Thank you for your support during our first year fo"
"tweetinsurance","Thu","0.00032506508712","0.0","0.25","The latest daily insurance on tweets eos bitcoin"
"Dadan kurniawan","Wed","0.00413297039339","0.0248744319541","0.06818181818181818","RT Connect now to Official Telegram Channel for Live updates about Digital Ticks Exchange digitalticksexchange telegram b"
"1DOLLAR","Tue","4.54498298101e-05","0.0385075340828","0.1","RT The surety airdrop is here receive up to 400 in surety tokens Sign up and complete the airdrop procedure to receive you"
"Social Start Now","Mon","1.0","0.0","0.09444444444444444","This comes as no surprise but social media truly is one of the most valuable opportunities for any small business"
"Sony joss","Sun","0.00346999570203","0.0102846209041","0.0","RT Transforming the global container shipping industry Join the Blockshipping ICO today CCC B"
"elsa uecke","Sat","0.000716328839399","0.0099258550586","0.0","RT Wanna earn 50 000 Tokens 1 Follow us 2 Retweet amp Like ALL posts 3 Comment your ETH Address ERC 20 4 Fill the fo"
"Fauzan Crypto","Fri","0.00203239782434","0.0","0.03333333333333333","Total valuation of 503 000 ETH of all tokens is a quite massive for an early stage project"
"cryptoanime","Thu","0.00206994333592","0.0251136091844","0.0","RT The technology of Blockchain is being utilized in the creation of cryptocurrency ventures into harnessing this pote"
"Aaron Crypto$$😎Dude","Wed","0.000215392671709","0.0193733556565","0.05","RT The Bitcoin hashrate jumped nearly 5 exahash in the last 2 weeks alone To put that gain in perspective it took 8 5 y"
"Chawansit","Tue","4.05096309177e-05","0.0675675675676","0.3","RT Bitcoin is by far the most energy efficient monetary system we ve ever designed"
"Voice Casino","Mon","0.000480187332342","0.0137526907438","0.0","RT for sale Crypto accepted cryptocurrency blockchain Ethereum CryptoNews fintech Bitcoin"
"Blockbid","Sun","0.002341654275","0.0013154747668","0.125","M Later LexisNexis Partners With First Institutional Cryptocurrency Exchange Blockbid Thank you for"
"Aang ⚡","Sat","0.00266276720301","0.00585984214303","0.3","RT Let s be honest 99 of us wouldn t give two shits about the financial sector if it wasn t for bitcoin"
"Hodl Hodl News","Fri","0.00227940776896","0.0","0.25","Korean authorities find no illegal activity in Bithumb investigation bitcoin"
"Marcos M","Thu","3.95215911393e-06","0.0271466156422","0.25","RT 1 Million DENT users achieved 3 weeks before the deadline on our Roadmap Thank you for your support during our first year fo"
"bitnewsbot.","Wed","0.000908996596203","0.0","-0.2","Hurry Up Get 20 Bonus Game Stars Tokens Until June 13th news cryptocurrencynews"
"Ruby","Tue","0.00353817044674","0.0102846209041","-0.125","RT We are acting on past mistakes by other platforms and the need for a community based investment alternative to help improve"
"Bull & Bear Research","Mon","0.000225273069494","0.0","0.1","Markets up modestly while our equity picks outperformed Our picks finished up 0 61 stocks stockmarket"
"ReformedShortTrader","Sun","0.000282579376646","0.00179382922746","0.13636363636363635","RT Bitcoin Cash Roundup New Apps Announcements and Developments bitcoin"
"deden","Sat","4.94019889241e-06","0.278521884717","0.5","RT Get More Tokens Send a minimum of 0 001ETH to 0xd506e5e57e22c695bf28c96e73c296051177a678 and get 444 444 tokens The more yo"
"HOST/GUESTLIST/LIMO","Fri","0.000630369378671","0.00310930399426","0.65","RT More Happy ThanksPIVing USA friends We re thankful you re part of our community PIVX is all about giving Our POS Proof of"
"abud","Thu","2.17368751266e-05","0.278521884717","0.5","RT Get More Tokens Send a minimum of 0 001ETH to 0xd506e5e57e22c695bf28c96e73c296051177a678 and get 444 444 tokens The more yo"
"Marry Sueberg","Wed","0.00318247612649","0.000119588615164","0.8","RT I will choose 5random followers to win 0 2 ETH 1000 SpritzCoin Please 1 2 FOLLOW 3 LIK"
"stoolander","Tue","0.000474259093671","0.0","0.0","Gary K Investors Edge Radio Show 06 08 2018 28 min stoolander edition gt"
"Eric","Mon","0.00181206495374","0.000239177230328","0.0","RT Breaking News NASA has found signs of TRX on Mars crypto btc eth bitcoin cryptocurrencynews tron trx"
"Leojjang","Sun","0.0","0.889260942358","0.0","RT We are airdropping 100 LightningNet LNET Follow us join our telegram and retweet this t"
"MillionaireAirdrop","Sat","4.94019889241e-05","0.000119588615164","0.8","I will choose 5random followers to win 0 2 ETH 1000 SpritzCoin Please 1 2 FOLLOW 3"
"Milanobass","Fri","0.000236141507057","0.00322889260942","0.0","RT 100 DHP Token FINAL AirDrop ONLY 7 DAYS LEFT SALE BEGINS JUNE 16th ERC20 TokenSale Airdrop ethereum ICO cry"
"نوري شاهين","Thu","0.0","0.06206649127","0.8","RT Dear MAVRO Holders and Leaders mavrodi bitcoin We are happy to announce that MAVRO Coin MVR will be officially li"
"charles mcbride","Wed","0.0","0.06206649127","0.8","RT Dear MAVRO Holders and Leaders mavrodi bitcoin We are happy to announce that MAVRO Coin MVR will be officially li"
"kuroshirorupan","Tue","0.000282579376646","0.0056206649127","0.0","RT Hello bountyhunters Wanna earn up to 50 000 Tokens Follow us Retweet amp Like our posts Comment your ETC Fill in ht"
"Aaron Crypto$$😎Dude","Mon","0.000215392671709","0.00837120306147","0.5","RT Coinbase acquired a securities dealer to let customers trade their ERC20 tokens More than 13 billion has been raised"
"IMAH HELEN","Sun","0.00101768097184","0.00322889260942","0.13434343434343435","RT THUGS WE NEED YOUR HELP TO LIST THUG ON A NEW EXCHANGE Vote for on Active traders have 5 FREE v"
"kelvin lam","Sat","2.07488353481e-05","0.0998564936618","0.2","RT Annual Economic Costs Banking 1 870B Gold Mining 105B Banking Electricity 63 8B Gold Recycling 40B Paper"
"Rasyonel","Fri","0.000282579376646","0.0212867734992","0.0","RT While trading on the exchange your holdings automatically sync with your Coinnup wallet cryptocurrency bitcoin"
"Rupakk  chakma","Thu","3.45813922469e-05","0.144463047118","0.14285714285714285","RT REACH AIRDROP just 2k people Claim 100 000 Reach tokens right now Simply follow the 3 steps 1 Follow REACH 2 Like"
"Byron Froneman","Wed","0.00031222057","0.0998564936618","0.2","RT Annual Economic Costs Banking 1 870B Gold Mining 105B Banking Electricity 63 8B Gold Recycling 40B Paper"
"Andriansyah","Tue","1.18564773418e-05","0.278521884717","0.5","RT Get More Tokens Send a minimum of 0 001ETH to 0xd506e5e57e22c695bf28c96e73c296051177a678 and get 444 444 tokens The more yo"
"Morgiana","Mon","0.00895559255216","0.0896914613729","0.0","RT This is not a drill Token sale starts now Cryptocurrency Bitcoin Ethereum Blockchain Mii Mensarii"
"Robyn","Sun","2.96411933544e-06","0.0135135135135","0.0","RT Coin of the week 7 days to vote Vote and Retweet crypto cryptocurrency bitcoin btc nem xem litecoin ltc ver"
"Casper Johansen","Sat","0.000244045825285","0.00980626644343","0.0","RT Three Luxury Apartments Sold for 420 BTC in the Coastal Region of Montenegro Bitcoin"
"Morgiana","Fri","0.00895559255216","0.0975843099737","0.0","RT Mensarii is simple It utilizes a decentralized cryptocurrency platform interacting with the Ethereum blockchain to settle"
"Adem Kul","Thu","1.58086364557e-05","0.000239177230328","-0.075","RT bitcoin cryptotrading crypto cryptocurrencies BTC UPDATE Some moving Average IDEAs on Daily Candlesticks SMMA"
"Matt Endless","Wed","2.6677074019e-05","0.0","-0.26666666666666666","This Bitcoin market is so heavily manipulated it s ridiculous The manipulators know we re watching the charts wi"
"José Esteban","Tue","1.18564773418e-05","0.00968667782827","0.15000000000000002","RT I will choose 20 random followers to win 0 2ETH Please 1 FOLLOW 2 LIKE AND RETWEET 3 Comment your ETH address air"
"GK","Mon","6.71867049367e-05","0.0","0.375","I ll make a controversial statement here but I really wish would take lightning symbol of his name"
"Djek","Sun","0.00745476012864","0.0281033245635","0.0","RT P2PS Review by CryptoOrders by Blockchain Cryptocurrency ethereum bitcoin token TokenSal"
"dolor enriquez","Sat","0.00227249149051","0.00382683568524","0.0","RT We have reached 25000 members on Telegram group and 14500 on Twitter Thank you for your support Cryptocurrency ICO"
"Uncaduv","Fri","0.000124493012089","0.00287012676393","0.25","RT Follow the hashrate The hashrate keeps going higher Price always follows hashrate Every currency in the world is cras"
"Adebayo lekan","Thu","9.78159380697e-05","0.000597943075819","0.4","RT For Every 25 000 x 100 2 500 000 FREE Tokens that I GiveAway I am rewarded with 1 000 000 000 Tokens ALL are Wi"
"BitcoinAgile","Wed","0.0480078647966","0.0","0.35000000000000003","Cryptocurrency Scams Becoming More Frequent in India NewsBTC bitcoin cryptocurrency Cybercrimes india"
