"duongtb.vms@gmail.com","Sat","9.88039778481e-07","0.00466395599139","-0.4","RT GAME X 200 000 000 GMX AIRDROP CONDITION FOLLOW RETWEET LIKE COMMENT YOUR ERC 20 eth btcm crypto payment topbtc"
"Crypto Town","Fri","0.00105325040386","0.0","0.0","Cointelegraph Governor of Connecticut Signs Blockchain Working Group Bill Into Law bitcoin ripple ethereum"
"Crypto Elite 📈🚀","Thu","0.00221814930269","0.0","0.0","BTC 4956 5699 Bounce Scenario Here s Why bitcoin btc"
"Devan Naratama","Wed","0.000373479036266","0.0","0.0","PERA Payera blockchain cryptocurrency shopera cardera tokensale bitcoin ethereum Website"
"Jon smith","Tue","0.000333957445127","0.000717531690983","0.0","RT Bitcoin miner aspires to launch largest crypto mining facility in the U S via"
"lelam","Mon","0.00164805035051","0.0","0.030303030303030304","Cryptocean seems to be garnering positive vibes amongst traders and investors In addition to typical investors ot"
"CryptoCrys","Sun","0.00024700994462","0.0","0.0375","Ok crypto peeps I have about treefidy to drop in a coin or few need some ideas I ve done a little DYOR Just want"
"Jah🇯🇲Coin","Sat","6.42225856013e-05","0.0","0.0","Speaking on Bloomberg today re crypto and regulators Bitcoin Ethereum blockchain"
"rifky hasan","Fri","0.00132002114405","0.0301363310213","0.16875","RT GREENBIT The Next Big Thing money millionaire business cash bitcoin success rich wealth entrepreneur billionair"
"Marry Sueberg","Thu","0.00318247612649","0.000119588615164","0.0","RT Earn 100 per TBC Coin Distributed Out of the Admin Wallet Send Your Friends here Please Ret"
"Crypto","Sat","0.000128445171203","0.000837120306147","0.4000000000000001","RT Heads up just heard a huge Bitcoin Whale With 94 947 BTC has just transferee their Crypto Onto an Exchange Rattli"
"Dallas Newman","Fri","4.84139491456e-05","0.0","0.0","BTC seems to be bouncing around inside the cloud walls on the 1hr BTC Bitcoin Crypto Ichi Ichimoto TA"
"Thanhjonhan#TraXionICO","Thu","0.00159667228203","0.0","0.0","Cryptocean s various functions and platform are explained as simply as possible Cryptocean Blockchain Bitcoin"
"Olivia Shepherd","Wed","0.000487103610791","0.0","0.2488888888888889","The Robot can tell the price movements in the next few seconds that s why it s easy to win much money very fast BestEA Bitcoin"
"Metatron Inc. (MRNJ)","Tue","0.183976958912","0.0","0.26666666666666666","MRNJ Bitcoin volatility keeping you up at night Download the 1 Free Deep Sleep Hypnosis Free App for Android Dev"
"kapil bhola","Mon","0.00358658439589","0.0460416168381","0.0","RT Only 2 days left to get 500 QRX for 1 ETH Don t miss LAST CHANCE to join the future of cryptotrading"
"alwija","Sun","0.00131014074627","0.0216455393447","0.09999999999999999","RT Hi Decoin Community Our presale stage 2 is open Dtep coin price of 65 for only 14 days We already sold 2 6m worth of dt"
"Crypto_techs","Sat","0.00221419714358","0.000239177230328","0.0","RT Apple s App Store Revises Cryptocurrency App Rules bitcoin"
"Spin Bits","Fri","0.000122516932532","0.00107629753647","0.0","RT What is Bitcoin City LandForSale BTC Blockchain Land Technology"
"Nicolò (尼科洛) Tilotta","Thu","0.000376443155601","0.000837120306147","0.0","RT LightningNetwork 2 405 nodes 8 324 channels 22 981 BTC capacity 1 848 public nodes 1 797 nodes with channels 93 channels op"
"Eduardo Gutiérrez","Wed","7.01508242722e-05","0.00502272183688","0.14242424242424243","RT In less than 3 days the Storeplex Pre ICO will be live There s a 100 bonus for early investors so make sure you re a p"
"Cryptonizuka Teacher Great","Tue","7.70671027216e-05","0.0","0.0","It can and it will be xrp ripple btc bitcoin"
"martina castro","Mon","0.0","0.0339631667065","0.0","RT JohnMcAfee Will Serve The Crypto Community When He Runs For President POTUS2020 The Future Is Com"
"Bitcoinity Fan","Sun","0.000529589321266","0.0675675675676","0.3","RT Bitcoin is by far the most energy efficient monetary system we ve ever designed"
"manlost111#TraXionICO","Sat","0.00144747827548","0.0","0.0","Cryptocean combines technological and financial services on a platform where fiat digital financial assets and cr"
"Fiat Killer","Fri","3.26053126899e-05","0.000358765845492","0.25","RT Follow the hashrate The hashrate keeps going higher Price always follows hashrate Every currency in the world"
"Growth48","Thu","0.00125777463801","0.0","0.0","Certified Blockchain amp Bitcoin Courses blockchain Bitcoin Ethereum"
"Crypto Airdrops","Wed","0.000181799319241","0.0","0.13636363636363635","Bitcoin Satoshi Earn Money cryptocurrency blockchain Airdrop New Airdrop SocialGood The commemoration of"
"🐋","Tue","5.92823867089e-06","0.0173403491988","0.0","RT When bitcoin was 1 000 people dreamt of 7 000 BTC When bitcoin was 15 000 people dreamt of buying 7 000 BTC Now we"
"znavaz","Mon","0.000350754121361","0.267280554891","0.0","RT 444Million Token Airdrop Starts Join Now Airdrop freetoken freecoin erc20 ethereum eth eth"
"Ukan kurniawan","Sun","0.00382173786317","0.000717531690983","0.6000000000000001","RT Happy Friday and enjoy the weekend 1 ETH 100000 PKG Contract address 0x02f2d4a04e6e01"
"BinaryFest.Com","Sat","0.00020847639326","0.0","0.0","BinaryFest BinaryOptions Forex Bitcoin MakeMoney The Enforcement Wave is Here Binary Options CEO Arrested in the US"
"hoangle1523#TraXionICO","Fri","0.00158185168535","0.0","0.0","Instead of competing and going against the traditional banking and financial systems one of his and Cryptocean s m"
"pump no dump   #beattoken","Thu","0.00116489889883","0.000478354460655","0.34285714285714286","RT Start the weekend off right with some light bitcoin humor by checking out hit Youtube Music Video Bitcoin Bil"
"Chris⚡Given","Wed","0.00123900188222","0.00394642430041","-0.2","RT I use Bitcoin everyday No I don t spend it on bread or coffee but by HODLing it I get the peace of mind of having an as"
"duongtb.vms@gmail.com","Tue","9.88039778481e-07","0.00466395599139","-0.4","RT GAME X 200 000 000 GMX AIRDROP CONDITION FOLLOW RETWEET LIKE COMMENT YOUR ERC 20 eth btcm crypto payment topbtc"
"Crypto Town","Mon","0.00105325040386","0.0","0.0","Cointelegraph Governor of Connecticut Signs Blockchain Working Group Bill Into Law bitcoin ripple ethereum"
"Crypto Elite 📈🚀","Sun","0.00221814930269","0.0","0.0","BTC 4956 5699 Bounce Scenario Here s Why bitcoin btc"
"Devan Naratama","Sat","0.000373479036266","0.0","0.0","PERA Payera blockchain cryptocurrency shopera cardera tokensale bitcoin ethereum Website"
"Jon smith","Fri","0.000333957445127","0.000717531690983","0.0","RT Bitcoin miner aspires to launch largest crypto mining facility in the U S via"
"lelam","Thu","0.00164805035051","0.0","0.030303030303030304","Cryptocean seems to be garnering positive vibes amongst traders and investors In addition to typical investors ot"
"CryptoCrys","Wed","0.00024700994462","0.0","0.0375","Ok crypto peeps I have about treefidy to drop in a coin or few need some ideas I ve done a little DYOR Just want"
"Jah🇯🇲Coin","Tue","6.42225856013e-05","0.0","0.0","Speaking on Bloomberg today re crypto and regulators Bitcoin Ethereum blockchain"
"rifky hasan","Mon","0.00132002114405","0.0301363310213","0.16875","RT GREENBIT The Next Big Thing money millionaire business cash bitcoin success rich wealth entrepreneur billionair"
"Marry Sueberg","Sun","0.00318247612649","0.000119588615164","0.0","RT Earn 100 per TBC Coin Distributed Out of the Admin Wallet Send Your Friends here Please Ret"
"xDystopium","Sat","0.0115640175673","0.000119588615164","0.0","RT Gambling Porn Network 250 GPN Tokens Airdrop 50 1 Register 2 Login and submit your ETH"
"Crypto Shaf","Fri","0.000192667756804","0.0","0.0","Another day another daylight robbery 3 spread Followed by lt 0 2 on binance cryptocurency bitcoin"
"vuong841982","Thu","9.88039778481e-07","0.00466395599139","-0.4","RT GAME X 200 000 000 GMX AIRDROP CONDITION FOLLOW RETWEET LIKE COMMENT YOUR ERC 20 eth btcm crypto payment topbtc"
"Moel","Wed","8.89235800633e-06","0.00275053814877","-0.05","RT Venezuelan Government has issued an official statement eliminating obstacles to the import of mining equipment crypto"
"TheMarketQuote","Tue","0.00242168549706","0.0","-0.26666666666666666","Bitcoin BTC XBT is the most boring trade and investment as of late for me"
"rifky hasan","Mon","0.00132002114405","0.0289404448696","0.6428571428571428","RT Merchants consumers and investors need the right farm and market with best values Each year over 300 billion is lost as"
"Sum Chhengse","Sun","3.95215911393e-05","0.00837120306147","0.5","RT Coinbase acquired a securities dealer to let customers trade their ERC20 tokens More than 13 billion has been raised"
"Jonathas Carrijo","Sat","0.000626417219557","0.0556087060512","0.4","RT The Bitcoin Standard is now available on Audible Retweet this for a chance to win one of five free download coupons htt"
"Agdal","Fri","0.00012350497231","0.000597943075819","0.0","RT Join the Official Monarch Token Telegram Channel here and chat with the team gt monarchtok"
"Live Generously","Thu","0.000115600654082","0.0484333891414","0.0","RT We did it 2 Atomic Swap on Lightning between BTC amp LTC Kudos to from pioneering this Who is 3"
"eso [LTC]","Wed","8.49714209494e-05","0.0484333891414","0.0","RT We did it 2 Atomic Swap on Lightning between BTC amp LTC Kudos to from pioneering this Who is 3"
"Moel","Tue","8.89235800633e-06","0.00334848122459","0.0","RT Cryptcurrency bitcoin ethereum Ripple ICOs cryptocurrency"
"Louis Truong #TraxionICO","Mon","0.00251653731579","0.0216455393447","0.6000000000000001","RT The Beta version of Qurrex amazing trading platform is already online at TokenSale bitcoin crypto"
"Bill Burdin","Sun","0.0033978687982","0.00394642430041","-0.2","RT I use Bitcoin everyday No I don t spend it on bread or coffee but by HODLing it I get the peace of mind of having an as"
"bitcroc","Sat","1.97607955696e-06","0.889260942358","0.0","RT We are airdropping 100 LightningNet LNET Follow us join our telegram and retweet this t"
"znavaz","Fri","0.000350754121361","0.0","0.5","Get More Tokens Send a minimum of 0 001ETH to 0xd506e5e57e22c695bf28c96e73c296051177a678 and get 444 444 tokens"
"Earn Money Online Opportunity","Thu","0.000596776026203","0.00143506338197","-0.4","RT Bitcoin crypto blockchain Airdrop Earn Passive Income in Ether from Ether Estate s Collectibles Game EtherEst"
"CrypToPR","Wed","0.00156703108867","0.0","0.2","Do We Really Need Cryptocurrency A Modern Exploration of Money Click ripple"
"Crypto Airdrops","Tue","0.000415964746741","0.0","0.13636363636363635","Bitcoin Satoshi Earn Money cryptocurrency blockchain Airdrop New Airdrop SocialGood The commemoration of"
"Jolo","Mon","8.89235800633e-06","0.278043530256","0.5","RT Get More Tokens Send a minimum of 0 001ETH to 0xd506e5e57e22c695bf28c96e73c296051177a678 and get 444 444 tokens The more yo"
"lawrence","Sun","0.000642225856013","0.000717531690983","0.0","RT Bitcoin miner aspires to launch largest crypto mining facility in the U S via"
"Leo Jdbr","Sat","1.38325568987e-05","0.00251136091844","0.1","RT Colombia is looking into how blockchain can be applied across administrative economic and political spheres"
"Mike","Fri","0.000115600654082","0.267280554891","0.0","RT 444Million Token Airdrop Starts Join Now Airdrop freetoken freecoin erc20 ethereum eth eth"
"Sridhar Chandra","Thu","0.000115600654082","0.0086103802918","0.0","RT What are some advantages of Blockchain MT"
"JT","Wed","0.000290483694874","0.00322889260942","0.0","RT Bitcoin will double in value by the end of the year despite its recent price stagnation according to several cryptocu"
"Bull","Tue","0.000329017246234","0.00394642430041","-0.2","RT I use Bitcoin everyday No I don t spend it on bread or coffee but by HODLing it I get the peace of mind of having an as"
"@hero0ne","Mon","1.97607955696e-06","0.278163118871","0.5","RT Get More Tokens Send a minimum of 0 001ETH to 0xd506e5e57e22c695bf28c96e73c296051177a678 and get 444 444 tokens The more yo"
"R.J.","Sun","0.000625429179779","0.000597943075819","0.0","RT Cryptomining applications suspended in Quebec via bitcoin btc xrp eth block"
"crypto_timelord","Sat","0.000756838470317","0.00932791198278","0.25","RT Bitcoin now consumes more than 1 000 kWh per transaction Meanwhile BURST only consumes 0 2 kWh per transaction at 1"
"NGUYEN TIEN THANH","Fri","9.38637789557e-05","0.0099258550586","0.0","RT Wanna earn 50 000 Tokens 1 Follow us 2 Retweet amp Like ALL posts 3 Comment your ETH Address ERC 20 4 Fill the fo"
"Amir Mohamad","Thu","2.8653153576e-05","0.00251136091844","0.1","RT Colombia is looking into how blockchain can be applied across administrative economic and political spheres"
"sigityak","Wed","2.8653153576e-05","0.278163118871","0.5","RT Get More Tokens Send a minimum of 0 001ETH to 0xd506e5e57e22c695bf28c96e73c296051177a678 and get 444 444 tokens The more yo"
"Eos","Tue","0.000109672415411","0.000119588615164","-0.8","RT EOS Price is 0 00187223 0 00001836 BTC 14 291 0 12460 USD Market rank is 5 eos bitcoin blockchain"
"mylaw","Mon","3.55694320253e-05","0.0484333891414","0.0","RT We did it 2 Atomic Swap on Lightning between BTC amp LTC Kudos to from pioneering this Who is 3"
"CDS","Sun","1.08684375633e-05","0.000717531690983","-0.016666666666666663","RT BTC bitcoin bearish engulfing on the daily candle close where the red candle body completely engulfed the previous"
"Arga permana","Sat","2.07488353481e-05","0.278163118871","0.5","RT Get More Tokens Send a minimum of 0 001ETH to 0xd506e5e57e22c695bf28c96e73c296051177a678 and get 444 444 tokens The more yo"
"Coinboard","Fri","0.00559526926554","0.0","0.0","Governor of Connecticut Signs Blockchain Working Group Bill Into Law via"
"itobore Kelvin G","Thu","5.63182673734e-05","0.278163118871","0.5","RT Get More Tokens Send a minimum of 0 001ETH to 0xd506e5e57e22c695bf28c96e73c296051177a678 and get 444 444 tokens The more yo"
"Earn Money Online Opportunity","Wed","0.000596776026203","0.0","0.13636363636363635","Bitcoin Satoshi Earn Money cryptocurrency blockchain Airdrop New Airdrop SocialGood The commemoration of"
"anh","Tue","2.96411933544e-06","0.278163118871","0.5","RT Get More Tokens Send a minimum of 0 001ETH to 0xd506e5e57e22c695bf28c96e73c296051177a678 and get 444 444 tokens The more yo"
"Lhei Lopez","Mon","0.00734311163367","0.267280554891","0.0","RT 444Million Token Airdrop Starts Join Now Airdrop freetoken freecoin erc20 ethereum eth eth"
"yuda_well","Sun","2.96411933544e-06","0.278163118871","0.5","RT Get More Tokens Send a minimum of 0 001ETH to 0xd506e5e57e22c695bf28c96e73c296051177a678 and get 444 444 tokens The more yo"
"JIMOH DIYA","Sat","0.000191679717025","0.267280554891","0.0","RT 444Million Token Airdrop Starts Join Now Airdrop freetoken freecoin erc20 ethereum eth eth"
"@germiyanman","Fri","4.05096309177e-05","0.00621860798852","0.15000000000000002","RT I will choose 20 random followers to win 0 2ETH Please 1 FOLLOW 2 LIKE AND RETWEET 3 Comment your ETH address air"
"Ohio Bitcoin","Thu","0.0198487311099","0.0","0.0","Governor of Connecticut Signs Blockchain Working Group Bill Into Law bitcoin bitcoinprice BTCtoUSD btcprice"
"RacingTrader77","Wed","2.6677074019e-05","0.0","-0.07777777777777779","Alright so do I double down on NCASH now At 2cents 260 Sats BTC BTCUSD Bitcoin"
"Marry Sueberg","Tue","0.00318247612649","0.000597943075819","0.15000000000000002","RT I will choose 50 random followers to win 10 000NEOC Please 1 FOLLOW 2 LIKE AND RETWEET 3 Comm"
"BitcoinJake09","Mon","0.000227249149051","0.0","0.0","So If you a tadpole grows up to be a frog and you cut its legs off its a tadpole again Smh Things evolve for"
"Cameron Merkel","Sun","0.00243255393462","0.0541736426692","-0.15","RT OUR PRE SALE RATE OF 0 08 ENDS at Midnight GMT on June 2nd Register before its too late and the price increases to 0 10 pe"
"Mike","Sat","0.000115600654082","0.278163118871","0.5","RT Get More Tokens Send a minimum of 0 001ETH to 0xd506e5e57e22c695bf28c96e73c296051177a678 and get 444 444 tokens The more yo"
"Yahoo Finance","Fri","0.811453357112","0.000717531690983","0.0","Bitcoin miner aspires to launch largest crypto mining facility in the U S via"
"Social Tweets","Thu","0.0971865567308","0.0","0.0","People are taking to twitter about your company wsj nytimes reuters bloomberg"
"Samuel Asare","Wed","0.0","0.0","0.4","Free Bitcoins Faucet Earn 100 free btc in 5 minutes bitcoin freebtc getbtc"
"JL Westside ⛹🏽[VTC]","Tue","0.000131409290538","0.0484333891414","0.0","RT We did it 2 Atomic Swap on Lightning between BTC amp LTC Kudos to from pioneering this Who is 3"
"Buy The ATH ⚡️ (100K 2018!)","Mon","0.00237425958769","0.000119588615164","0.0","RT The Queensland beach town where you can pay for your holiday in bitcoin"
"Mitch Lee","Sun","0.000430785343418","0.00167424061229","0.0","RT Speaking on Bloomberg today re crypto and regulators Bitcoin Ethereum blockchain"
"Earn Money Online Opportunity","Sat","0.000596776026203","0.000358765845492","0.13636363636363635","RT Bitcoin cryptocurrency Airdrop New Airdrop KoniosOfficial Airdrop 500 KON to the community 1"
"Dedi setiawan","Fri","1.97607955696e-06","0.278282707486","0.5","RT Get More Tokens Send a minimum of 0 001ETH to 0xd506e5e57e22c695bf28c96e73c296051177a678 and get 444 444 tokens The more yo"
"Alex Destruction","Wed","0.0165941280796","0.0216455393447","0.6000000000000001","RT The Beta version of Qurrex amazing trading platform is already online at TokenSale bitcoin crypto"
"BitcoinsChannel","Tue","0.00672361069257","0.0","0.35000000000000003","Cryptocurrency Scams Becoming More Frequent in India Bitcoin Crypto News Blockchain"
"Joël de Tombe","Mon","0.00279220041399","0.0997369050466","0.2","RT Annual Economic Costs Banking 1 870B Gold Mining 105B Banking Electricity 63 8B Gold Recycling 40B Paper"
"JIMOH DIYA","Sun","0.000191679717025","0.278282707486","0.5","RT Get More Tokens Send a minimum of 0 001ETH to 0xd506e5e57e22c695bf28c96e73c296051177a678 and get 444 444 tokens The more yo"
"LowFloatMix","Sat","0.000335933524684","0.000478354460655","0.0","RT HVCW Fundamentals 1 053 332 in Rev 3 25 2018 Gross margin 734 921 Gross margin percentage 69 8 Net revenue 3 13"
"André the GIANT ⚡️","Fri","0.000260842501519","0.00849079167663","0.0","RT We are giving away 0 1 DASH Steps 1 Retweet this post 2 Like this post 3 Follow To participate y"
"Ashish Kumawat","Thu","0.00021440463193","0.00597943075819","0.4","RT Jbox is giving free FIFA match tickets click on below link to participate FIFAWCOnStarTimes jbxfi"
"Twin Star MN","Wed","0.0205423350344","0.0","0.0","Get it ICO influence wsj nytimes reuters bloomberg thestreet jimmyfallon forbes"
"zhanghuiwen","Tue","0.0","0.889260942358","0.0","RT We are airdropping 100 LightningNet LNET Follow us join our telegram and retweet this t"
"Berminal","Mon","9.88039778481e-07","0.00167424061229","0.0","RT Speaking on Bloomberg today re crypto and regulators Bitcoin Ethereum blockchain"
"Cryptocurrbit[BoycottRogerKVer]","Sun","0.0031222057","0.00621860798852","0.0","RT The urge for humans to mine Bitcoin as the difficulty rises is irresistible and will never stop not even after every fiat"
"Bitcoin Beeotch","Sat","0.00251950143513","0.0398230088496","-0.15","RT OUR PRE SALE RATE OF 0 08 ENDS at Midnight GMT on June 2nd Register before its too late and the price increases to 0 10 pe"
"Lhei Lopez","Fri","0.00734311163367","0.278282707486","0.5","RT Get More Tokens Send a minimum of 0 001ETH to 0xd506e5e57e22c695bf28c96e73c296051177a678 and get 444 444 tokens The more yo"
"Michael Goldstein","Thu","0.0202301144644","0.00394642430041","-0.2","RT I use Bitcoin everyday No I don t spend it on bread or coffee but by HODLing it I get the peace of mind of having an as"
"allthattimes2","Wed","0.00212724964307","0.0172207605836","0.0","RT You can buy your desired cryptocurrency using the Swift Swap CSS and also cut the conversion cost by 75 cryptoc"
"Apurba Kumar","Tue","0.00114513810326","0.000119588615164","0.0","RT Perspective 101 btc blockchaintechnology trading money asset investing investment finance income Banking"
"Morgan","Mon","0.00523661082595","0.000597943075819","0.25","RT We have now sold our first 20 residential plots at I need 3 businesses to come to the town must be Bitco"
"Krishna Bogati","Sun","1.97607955696e-06","0.889260942358","0.0","RT We are airdropping 100 LightningNet LNET Follow us join our telegram and retweet this t"
"Fiat Killer","Sat","3.26053126899e-05","0.00621860798852","0.0","RT The urge for humans to mine Bitcoin as the difficulty rises is irresistible and will never stop not even after every fiat"
"bitmex","Fri","0.000497972048355","0.0","0.0","Bitmex Industry leading leverage up to 100x without expiries Bitcoin Crypto"
"Earn Money Online Opportunity","Thu","0.000596776026203","0.00119588615164","0.13636363636363635","RT Bitcoin Satoshi Earn Money cryptocurrency blockchain Airdrop New Airdrop COSS COSS Trading promo with 1 000 000"
"HammerDown","Wed","0.00119058793307","0.000239177230328","0.13636363636363635","RT New node who dis We ve updated our Bitcoin LightningNetwork node amp have a new address for you to connect to"
"Rosellie Dawami","Tue","0.000122516932532","0.0","-0.2","Help us get listed on Shardax exchange by voting here and earn 2 Capras everyday You can"
"Small Cap Society","Mon","0.0189318301955","0.0","0.0","This is me with the current price bitcoin cryptocurrency blockchain"
"Fiat Killer","Sun","3.26053126899e-05","0.0997369050466","0.2","RT Annual Economic Costs Banking 1 870B Gold Mining 105B Banking Electricity 63 8B Gold Recycling 40B Paper"
"Безумный Запорожец","Sat","0.000961362704462","0.165391054772","0.0","RT Invest with Impact Invest with Certainty Invest with RECF bitcoin money cryptocurrency cr"
"Buy The ATH ⚡️ (100K 2018!)","Fri","0.00237425958769","0.00621860798852","0.0","RT The urge for humans to mine Bitcoin as the difficulty rises is irresistible and will never stop not even after every fiat"
"BitcoinAgile","Thu","0.0480078647966","0.0","0.0","Bull Run Bounce by trader lachdix published June 08 2018 BTCUSD"
"TheMmp #ICO","Wed","0.00411617371715","0.00502272183688","0.14242424242424243","RT In less than 3 days the Storeplex Pre ICO will be live There s a 100 bonus for early investors so make sure you re a p"
"Aswin ps","Tue","1.28445171203e-05","0.00597943075819","0.4","RT Jbox is giving free FIFA match tickets click on below link to participate FIFAWCOnStarTimes jbxfi"
"Lilla Bracken","Mon","1.38325568987e-05","0.000119588615164","0.0","RT ACCESS Association of Cryptocurrency Enterprises amp Startups Biz eBiz CryptoBiz CryptoC"
"⚡CRYPTOLOGIST⚡","Sun","0.000779563385222","0.000717531690983","0.0","RT Bitcoin Fees measured in sat byte have now been cheaper than BCH for over a week Source http"
"Frosa","Sat","1.77847160127e-05","0.00621860798852","0.0","RT The urge for humans to mine Bitcoin as the difficulty rises is irresistible and will never stop not even after every fiat"
"stephen sego","Fri","0.000317160768893","0.267280554891","0.0","RT 444Million Token Airdrop Starts Join Now Airdrop freetoken freecoin erc20 ethereum eth eth"
"Андрей Архипенко","Thu","0.00682142663064","0.267280554891","0.0","RT 444Million Token Airdrop Starts Join Now Airdrop freetoken freecoin erc20 ethereum eth eth"
"hahaha","Wed","3.16172729114e-05","0.00837120306147","0.5","RT Coinbase acquired a securities dealer to let customers trade their ERC20 tokens More than 13 billion has been raised"
"Wu Yiren","Tue","8.89235800633e-06","0.00143506338197","0.0","RT Crypto Back to Basics Proof of Work and Proof of Stake are software algorithms used for reaching a consensus on a"
"stephen sego","Mon","0.000317160768893","0.278282707486","0.5","RT Get More Tokens Send a minimum of 0 001ETH to 0xd506e5e57e22c695bf28c96e73c296051177a678 and get 444 444 tokens The more yo"
"Earn Money Online Opportunity","Sun","0.000596776026203","0.000119588615164","0.13636363636363635","RT Bitcoin cryptocurrency Airdrop New Airdrop SHEC Bonus 500 SHEC Token Fill out form and Receive 500 SHEC Tokens"
"Coolwired","Sat","0.00062444114","0.0","0.425","The latest Cool Tech Times bitcoin socialmedia"
"Seere","Fri","4.24857104747e-05","0.00310930399426","0.2857142857142857","RT When I started buying Bitcoin at 3 in 2011 told me to wait She was right She started buying at 1"
"Block Frontier","Thu","0.000912948755317","0.0","0.1","The world s largest producer of bitcoin mining chips which is run by a 32 year old billionaire is reportedly con"
"Buy The ATH ⚡️ (100K 2018!)","Wed","0.00237425958769","0.000717531690983","0.0","RT Bitcoin Fees measured in sat byte have now been cheaper than BCH for over a week Source http"
"Serenitey","Tue","0.00200473271054","0.000597943075819","0.15000000000000002","RT I will choose 50 random followers to win 10 000NEOC Please 1 FOLLOW 2 LIKE AND RETWEET 3 Comm"
"Андрей Архипенко","Mon","0.00682142663064","0.278282707486","0.5","RT Get More Tokens Send a minimum of 0 001ETH to 0xd506e5e57e22c695bf28c96e73c296051177a678 and get 444 444 tokens The more yo"
"HudsonProdigy","Sun","6.32345458228e-05","0.0997369050466","0.2","RT Annual Economic Costs Banking 1 870B Gold Mining 105B Banking Electricity 63 8B Gold Recycling 40B Paper"
"Krypto","Sat","8.79355402849e-05","0.00980626644343","0.0","RT Three Luxury Apartments Sold for 420 BTC in the Coastal Region of Montenegro Bitcoin"
"Ricardo","Fri","9.88039778481e-06","0.278282707486","0.5","RT Get More Tokens Send a minimum of 0 001ETH to 0xd506e5e57e22c695bf28c96e73c296051177a678 and get 444 444 tokens The more yo"
