"duongtb.vms@gmail.com","Sat","9.88039778481e-07","0.00466395599139","-0.4","RT GAME X 200 000 000 GMX AIRDROP CONDITION FOLLOW RETWEET LIKE COMMENT YOUR ERC 20 eth btcm crypto payment topbtc"
"Bank Hodl","Sun","5.1378068481e-05","0.0","0.0","The bankers have been holding all the cards for 100 years now so of course they have b"
"Altcoin Crypto Hab0t","Sat","0.000185751478355","0.0013154747668","0.0","RT A Multi Trillion Dollar market needs solid foundation to get built Crypto market being based on Bitcoin which is one"
"mike adamo","Fri","0.000135361449652","0.00872996890696","0.5","RT Coinbase acquired a securities dealer to let customers trade their ERC20 tokens More than 13 billion has been raised"
"Pennytracker","Thu","6.42225856013e-05","0.000239177230328","-0.1","RT SEC Chairman Cryptocurrencies These are replacements for sovereign currencies replace the dollar the euro the yen wi"
"Digitalcoin","Wed","0.00155023441244","0.00621860798852","0.0","RT The urge for humans to mine Bitcoin as the difficulty rises is irresistible and will never stop not even after every fiat"
"Crypto Time","Tue","0.000134373409873","0.0","0.0","We haven t witnessed the market being this stagnant and actually holding price points for longer than 2 3 days in a"
"Grubzy'N'more","Mon","0.000297399973323","0.269911504425","0.0","RT 444Million Token Airdrop Starts Join Now Airdrop freetoken freecoin erc20 ethereum eth eth"
"When lambo? when moon?","Sun","0.00109573611434","0.00669696244917","0.0","RT Bitcoin costs part I Bitcoin beats every alternative in dollar costs even though they have risen to 5B 2017 est Caveats"
"Kristian","Sat","0.000839833811709","0.0","-0.5","Maybe totally wrong but think if BTC BITCOIN was heading lower it would have done so by now Lower lows been set each time"
"Small Cap Society","Fri","0.0189318301955","0.0","0.0","Cybersecurity Pioneer Corporate Leaders Continue to Ignore Threats bitcoin"
"Cozy Concession","Thu","0.000292459774431","0.00872996890696","0.5","RT Coinbase acquired a securities dealer to let customers trade their ERC20 tokens More than 13 billion has been raised"
"Olumide Emmanuel","Wed","0.000717316879178","0.269911504425","0.0","RT 444Million Token Airdrop Starts Join Now Airdrop freetoken freecoin erc20 ethereum eth eth"
"⚡️Bitcoin Puerto Rico⚡️","Tue","0.00129334407003","0.0","-0.16666666666666666","In less than 5 minutes you can start accepting bitcoin lighting or on chain payments with We already d"
"Digitalcoin","Mon","0.00155023441244","0.0013154747668","0.0","RT Bitcoin price forecast to double as experts revise cryptocurrency predictions The Independent"
"Robert Knapp","Sun","0.000822049095697","0.100095670892","0.2","RT Annual Economic Costs Banking 1 870B Gold Mining 105B Banking Electricity 63 8B Gold Recycling 40B Paper"
"Digitalcoin","Sat","0.00155023441244","0.00107629753647","0.06818181818181818","RT Talking bitcoin with and at his new bar Big things coming"
"Boris Bateman","Fri","0.00343739038934","0.0214063621143","0.0","RT While trading on the exchange your holdings automatically sync with your Coinnup wallet cryptocurrency bitcoin"
"Coupons Expert","Thu","0.013216020077","0.0265486725664","0.21666666666666665","RT Paymaz ecosystem will have a crypto exchange a universal wallet B2B and B2C payment gateways and a strong POS network to he"
"Olumide Emmanuel","Wed","0.000717316879178","0.28067447979","0.5","RT Get More Tokens Send a minimum of 0 001ETH to 0xd506e5e57e22c695bf28c96e73c296051177a678 and get 444 444 tokens The more yo"
"Ozge Balci","Tue","0.00093073347133","0.0271466156422","0.0","RT While you trade on the Exchange your holdings will sync with your Coinnup Wallet automatically cryptocurrency bi"
"Crypto Analyst","Mon","0.000430785343418","0.000239177230328","0.4","RT Update Russia2018 Welcome to everyone With iOS system to confirm email pls open the link inside with SAFARI Jac"
"The Daily Block","Sun","0.000243057785506","0.0","0.0","BitPay Coinbase or Others Can Anybody Replace Visa bitcoin btc crypto cryptocurrency bitpay coinbase"
"5K | Rets💯🔱","Sat","0.00434045874687","0.000119588615164","0.0","RT Just FollowMe and i will FollowBack Soon and also add me on facebook thank you Bitcoin ICO Bou"
"Crypto Silent Bob","Fri","0.000402132189842","0.0013154747668","0.0","RT A Multi Trillion Dollar market needs solid foundation to get built Crypto market being based on Bitcoin which is one"
"D Nguyen","Thu","0.000346801962247","0.00119588615164","0.25","RT I got 2 big juicy stake rewards from my idealcash wallet today I do love that passive income DEAL bitcoin Ethereum l"
"Mark Herrington","Wed","0.000126469091646","0.00334848122459","0.2857142857142857","RT When I started buying Bitcoin at 3 in 2011 told me to wait She was right She started buying at 1"
"WeTee","Tue","0.0051378068481","0.000478354460655","0.6","RT Blockchain Bitcoin and You at NS3 in Detroit was excellent Thanks to John Heck Piper Moretti Matt Einheber for gr"
"Kuzaima","Mon","2.76651137975e-05","0.280794068405","0.5","RT Get More Tokens Send a minimum of 0 001ETH to 0xd506e5e57e22c695bf28c96e73c296051177a678 and get 444 444 tokens The more yo"
"trafik","Sun","0.000166978722563","0.100095670892","0.2","RT Annual Economic Costs Banking 1 870B Gold Mining 105B Banking Electricity 63 8B Gold Recycling 40B Paper"
"Daniel Rice","Sat","0.00133681782029","0.0","0.175","I find it extremely ironic that said they are more likely to list a coin with a public team than a"
"Tega Eljah","Fri","5.92823867089e-06","0.269911504425","0.0","RT 444Million Token Airdrop Starts Join Now Airdrop freetoken freecoin erc20 ethereum eth eth"
"Larry 'Coiny' Evans","Thu","0.0188310501381","0.000358765845492","0.0","RT One company leads Wall Street on Bitcoin We believe that this technology and this assetclass is going to change some f"
"Carl Job","Wed","0.00219740046734","0.0203300645779","0.03125","RT presents a unified interface while connecting the major components of Digital Asset Management cryptocurrency bit"
"Tega Eljah","Tue","5.92823867089e-06","0.280794068405","0.5","RT Get More Tokens Send a minimum of 0 001ETH to 0xd506e5e57e22c695bf28c96e73c296051177a678 and get 444 444 tokens The more yo"
"One Way To Rich #Traxion","Mon","0.00815034013269","0.000119588615164","0.0","Just FollowMe and i will FollowBack Soon and also add me on facebook thank you Bitcoin ICO Bou"
"Javier M","Sun","0.000329017246234","0.000119588615164","0.0","RT Bitcoin BTC Current Price 7 650 680 1 Hour 0 06 24 Hours 0 24 7 Days 2 18 btc bitcoin"
"DathBrisheD TS","Sat","9.88039778481e-07","0.0956708921311","0.19242424242424241","RT The PLEX airdrop is now live Receive 400 PLEX worth 200 Only 500 places be quick View our thread to participate http"
"ArabCryptin","Fri","0.00247997984399","0.056924180818","0.2833333333333333","RT cKEY is the most secure blockchaintechnology technology designed to assuage the complexity involved with long passw"
"analyst5","Thu","0.00589168119909","0.0","0.0","ETH 18 472m XLM 16 096m XVG 2 398m BTC 289 343m TRX 16 043m LTC 14 502"
"All Bitcoin News","Wed","0.00122418128554","0.0","0.13636363636363635","Bitcoin mining centralization problem solved with a new proposal from Bitcoin Core dev Bitcoin BTC Crypto"
"DathBrisheD TS","Tue","9.88039778481e-07","0.00538148768237","0.14242424242424243","RT In less than 3 days the Storeplex Pre ICO will be live There s a 100 bonus for early investors so make sure you re a p"
"Habib Ahsani","Mon","3.16172729114e-05","0.280794068405","0.5","RT Get More Tokens Send a minimum of 0 001ETH to 0xd506e5e57e22c695bf28c96e73c296051177a678 and get 444 444 tokens The more yo"
"CMM informaciòn","Sun","0.00072225707807","0.00287012676393","0.25","RT Follow the hashrate The hashrate keeps going higher Price always follows hashrate Every currency in the world is cras"
"Javier M","Sat","0.000329017246234","0.000239177230328","0.0","RT Bitcoin Cash BCH Current Price 1 123 960 1 Hour 0 07 24 Hours 1 43 7 Days 13 03 bch bitcoin cash"
"Rabia Awan","Fri","2.6677074019e-05","0.000478354460655","-0.4","RT GAME X 200 000 000 GMX AIRDROP CONDITION FOLLOW RETWEET LIKE COMMENT YOUR ERC 20 eth btcm crypto payment topbtc"
"Jumaane Williams","Thu","0.000886271681298","0.0","0.25","The latest The BOUT THAT BITCOIN Daily mining bitcoin"
"CriticalMassGym","Wed","0.00190691677247","0.056924180818","0.2833333333333333","RT cKEY is the most secure blockchaintechnology technology designed to assuage the complexity involved with long passw"
"Renato Catamora","Tue","3.35933524684e-05","0.012437215977","0.5333333333333333","RT JOIN THE AMAZING BITCOIN MAGIC PROJECT NAME BITCOIN MAGIC SYMBOL BTCM SUPPLY 2 000 000 000 GIVEAWAY AND AIRDROP"
"CHOWDER007","Mon","3.35933524684e-05","0.00466395599139","0.08","RT DeepOnion Voting at Tier1 Exchange is starting on 8th June 2018 Please help us get listed on this high volume Exch"
"Cryptonetix","Sun","0.00438986073579","0.0","0.0","Norwegian Air CEO Launching Bitcoin Exchange May Sell Tickets for Crypto crypto"
"myCryptoFreedom","Sat","0.00036458667826","0.0","0.0","Liberland Where AnarchyCapitalism Can Be Tested Land Where Cryptocurrency and Bitcoin Can Flourish"
"Hoàng Việt","Fri","4.94019889241e-06","0.0099258550586","0.0","RT Wanna earn 50 000 Tokens 1 Follow us 2 Retweet amp Like ALL posts 3 Comment your ETH Address ERC 20 4 Fill the fo"
"Rabia Awan","Thu","2.6677074019e-05","0.00621860798852","-0.4","RT GAME X 200 000 000 GMX AIRDROP CONDITION FOLLOW RETWEET LIKE COMMENT YOUR ERC 20 eth btcm crypto payment topbtc"
"boo","Wed","0.0","0.0265486725664","0.016666666666666663","RT Registrations for the Airdrop are open First round on the 9th of June Register here"
"Cryptosaver","Tue","9.28757391773e-05","0.0","0.0","Bitmain the world s largest producer of bitcoin mining ASICs may be about to go public Last year they made a rec"
"Blockchain & crypto currency news","Mon","0.00045548633788","0.0","0.0","Second Largest Bitcoin Cash Mining Pool Agrees to Process Zero Fee Transactions"
"ZenSocial Supporters","Sun","0.00994659644997","0.000119588615164","0.07142857142857142","RT Steve Wozniak Only Bitcoin is Pure Digital Gold newsoftheweek Bitcoin blockchain cryp"
"boo","Sat","0.0","0.0410188950012","-0.1","RT I feel the same way as Register here for our 1st round of Airdrop now"
"Winkdex Tweets","Fri","0.00324274655298","0.000119588615164","0.0","Two Hour Lull Update CryptoCompare Bitcoin price 7641 54 bitcoin"
"Kriz mendoza andal","Thu","0.00437800425845","0.0896914613729","0.0","RT This is not a drill Token sale starts now Cryptocurrency Bitcoin Ethereum Blockchain Mii Mensarii"
"Machrus Ulum","Wed","1.97607955696e-06","0.280794068405","0.5","RT Get More Tokens Send a minimum of 0 001ETH to 0xd506e5e57e22c695bf28c96e73c296051177a678 and get 444 444 tokens The more yo"
"Norm Brien","Tue","0.00126567895623","0.0","0.25","The latest The Data Storage Daily bitcoin"
"Tico Hiko","Mon","0.000392251792057","0.00597943075819","0.4","RT Jbox is giving free FIFA match tickets click on below link to participate FIFAWCOnStarTimes jbxfi"
"Digitalcoin","Sun","0.00155023441244","0.000239177230328","0.0","RT bitcoin and Retrograde amp Eclipse Events for 2018 by trader TreeTruffle published June 08 2018 BTCUSD"
"AnaV","Sat","4.14976706962e-05","0.0069361396795","0.2","RT Ready for the Blockchain World Conference Book your tickets now and don t miss the chance to be part of the biggest even"
"jaklom","Fri","0.00220234066624","0.0461612054532","0.0","RT Only 2 days left to get 500 QRX for 1 ETH Don t miss LAST CHANCE to join the future of cryptotrading"
"Javier M","Thu","0.000329017246234","0.00597943075819","0.6","RT Putin Cryptocurrency Has Its Place No State Can Have Own Crypto Bitcoin"
"kapo","Wed","0.000597764065981","0.0","0.25","SUMMER SALE NOWON Selling bitregion For sale 14 3bit If you are interested Please contact or DM me bitcoin bitregion Ethereum"
"Hanbin. -jfb?","Tue","0.00805944047307","0.0159052858168","0.4000000000000001","RT Crypto is coming to HOW exciting Crypto succession is more important than ever See to your legacy wit"
"jaklom","Mon","0.00220234066624","0.0220043051901","0.6000000000000001","RT The Beta version of Qurrex amazing trading platform is already online at TokenSale bitcoin crypto"
"Crypto Elite 📈🚀","Sun","0.00221913734247","0.000119588615164","0.0","Should I do a video on how I see bitcoin over the next 1 2 months"
"$Pirl","Sat","9.88039778481e-05","0.000358765845492","0.125","RT Interested in crypto and Bitcoin Check out Pirl PIRL A micro cap project with a big cap mentality Pay"
"Maroof sohail","Fri","0.000351742161139","0.0681655106434","0.3","RT Bitcoin is by far the most energy efficient monetary system we ve ever designed"
"Jimmy Cardenas","Thu","0.000233177387722","0.00621860798852","0.0","RT The urge for humans to mine Bitcoin as the difficulty rises is irresistible and will never stop not even after every fiat"
"Maze9902","Wed","6.91627844937e-06","0.000956708921311","0.06666666666666668","RT Bitcoin wastes too much energy Oh really How much does the whole banking system waste bitcoin"
"Suhas Ashok","Tue","0.000181799319241","0.000358765845492","0.5","RT How many xrp have you accumulated since you started crypto htmlcoin xrp ripple crypto cryptocurrency lambo mo"
"Digitalcoin","Mon","0.00155023441244","0.00322889260942","0.0","RT They keep telling me You need to diversify your investments I tell them I am I have five hardware wallets wit"
"CHOWDER007","Sun","3.35933524684e-05","0.0013154747668","0.13636363636363635","RT Do you like purple Did you see the new website link crypto bitcoin btc"
"SNFB, Inc.","Sat","0.181412995687","0.0","0.0","Get people taking to twitter about you wsj nytimes reuters bloomberg thestreet"
"OpcionesBinarias 360","Fri","0.00599542537583","0.000119588615164","0.6","RT Putin Cryptocurrency Has Its Place No State Can Have Own Crypto via bitcoin"
"BitcoinAgile","Thu","0.0480078647966","0.000239177230328","0.0","Retrograde amp Eclipse Events for 2018 by trader TreeTruffle published June 08 2018 BTCUSD"
"Coinboard","Wed","0.00559526926554","0.0","0.4","Mastercard Files Patent for Blockchain System to Secure Card Payments via"
"Javier M","Tue","0.000329017246234","0.00872996890696","0.5","RT Coinbase acquired a securities dealer to let customers trade their ERC20 tokens More than 13 billion has been raised"
"JNET","Mon","0.01565549029","0.0120784501315","0.7","RT Good Friday Autobayers MVP mvpbuzz f1jp eth ethereum howdoo btc btcc btcp btcpeek bitcoin Blockchain ripple"
"Redondo Music","Sun","7.80551425e-05","0.00872996890696","0.5","RT Coinbase acquired a securities dealer to let customers trade their ERC20 tokens More than 13 billion has been raised"
"CHOWDER007","Sat","3.35933524684e-05","0.0339631667065","0.0","RT JohnMcAfee Will Serve The Crypto Community When He Runs For President POTUS2020 The Future Is Com"
"Cryptonomy4world","Fri","0.000113624574525","0.000956708921311","0.3","RT If you don t think Bitcoin is by far the most energy efficient monetary system ever designed you re probably a nocoi"
"Leonardo Martinez","Thu","0.000927769351994","0.000119588615164","0.1","RT Is Bitcoin Really The Future Of Money blockchain cryptocurrency"
"mardhika kusuma bangun","Wed","0.00322891399608","0.0","0.2875","Capital highlights Privacy on highest levels Real decentralization User friendly"
"World Seeker","Tue","3.55694320253e-05","0.0","0.3","Crypto Millionaire Master Plan Is A College Degree Worth It via"
"OpcionesBinarias 360","Mon","0.00599542537583","0.000119588615164","0.0","RT Chinese Cryptomining Chip Giant Bitmain Is Considering an IPO via cryptocurrency"
"NEVAD Gaming","Sun","0.0103230396056","0.0120784501315","0.7","RT Good Friday Autobayers MVP mvpbuzz f1jp eth ethereum howdoo btc btcc btcp btcpeek bitcoin Blockchain ripple"
"AIEVE","Sat","0.000116588693861","0.00167424061229","0.25","RT Russian Court Overturns Decision to Block Bitcoin Website Read more here visit our website http"
"CHOWDER007","Fri","3.35933524684e-05","0.000717531690983","0.34545454545454546","RT The new official website is incredible This privacy coin is one you will definitely want to have in your port"
"AlpoCrypto","Thu","7.70671027216e-05","0.0","0.35","Truely eye opening A must watch"
"CHOWDER007","Wed","3.35933524684e-05","0.0101650322889","0.1049242424242424","RT Good day crypto Due to roadmap team is working hard to add the new exchange listing Now you can trade onions on"
"ifeoma  Omordi","Tue","1.28445171203e-05","0.00514231045204","0.0","RT Check out Parkres press release Bitcoin Parkres Parkresico ethereum cryptocurrency cryptocur"
"Suhas Ashok","Mon","0.000181799319241","0.000358765845492","0.0","RT Go digibyte Choo choo dgb rdd xvg verge xrp trn trx tron bitcoin htmlcoin paccoin litecoin etherium eth cryp"
"Bearly Rational","Sun","0.000142277728101","0.000358765845492","0.3666666666666667","RT How to make better sense on the current state of crypto let s assemble as its own periodic table in this moment of ti"
"Marcel Xavier","Sat","7.21269038291e-05","0.00119588615164","0.21111111111111114","RT Singer has enjoyed success as a member of the hip hop group the Black Eyed Peas and as a solo artist"
"Ed Bishop","Fri","2.56890342405e-05","0.000956708921311","0.0","RT Official release of Whitepaper 2 0 Nullex Whitepaper crypto Cryptocurrency Altcoins Bitc"
"BULVRD App","Thu","7.90431822785e-06","0.0","0.13636363636363635","Our Beta is now live Waze for the Earn ethereum tokens by contributing"
"Hamid Bender","Wed","5.92823867089e-05","0.00119588615164","0.21111111111111114","RT Singer has enjoyed success as a member of the hip hop group the Black Eyed Peas and as a solo artist"
"Alisa Salipi","Tue","0.00192470148848","0.035039464243","0.0","RT EXCLUSIVE AIRDROP We decided to give 100 000 CALL amp 20 000 000 CALLG to our supporters If you want to join follow t"
"Rome","Mon","0.00197311543763","0.000239177230328","0.0","RT We go UP from here BTC Bitcoin"
"Samar Edward","Sun","8.89235800633e-06","0.00119588615164","0.21111111111111114","RT Singer has enjoyed success as a member of the hip hop group the Black Eyed Peas and as a solo artist"
"Crypto MayMay","Sat","0.00348185217937","0.0269074384119","0.1","RT Buy cryptocurrency with Fiat Transact directly with the Wallet Reduce the transaction time as well as the cost by"
"Dr. Robert Bruce Banner","Fri","0.00485226335212","0.00585984214303","0.3","RT Let s be honest 99 of us wouldn t give two shits about the financial sector if it wasn t for bitcoin"
"Ahmet Crovo","Thu","6.02704264874e-05","0.00119588615164","0.21111111111111114","RT Singer has enjoyed success as a member of the hip hop group the Black Eyed Peas and as a solo artist"
"Y5 Creative","Wed","0.00253531007158","0.0","0.0","Andy Warhol has another 15 minutes of fame as a bitcoin star via bitcoin Crypto"
"JEHB40","Tue","9.18876993988e-05","0.000358765845492","-0.2916666666666667","RT you just got called out HARD by my boy REEDEM YOURSELF Put out a DIG forecast If you ar"
"Galois Flores","Mon","1.67966762342e-05","0.281033245635","0.5","RT Get More Tokens Send a minimum of 0 001ETH to 0xd506e5e57e22c695bf28c96e73c296051177a678 and get 444 444 tokens The more yo"
"Britama Wilix ⚡","Sun","2.96411933544e-05","0.0","0.0","Still around 7200 7990 usd Valid till October 2018 blockchain I dont know after October will up or not"
"George Colon","Sat","4.74259093671e-05","0.00119588615164","0.21111111111111114","RT Singer has enjoyed success as a member of the hip hop group the Black Eyed Peas and as a solo artist"
"Reginald Egbuniwe","Fri","3.45813922469e-05","0.0271466156422","0.25","RT 1 Million DENT users achieved 3 weeks before the deadline on our Roadmap Thank you for your support during our first year fo"
"Tuan Tran","Thu","0.000860582647057","0.0386271226979","0.1","RT The surety airdrop is here receive up to 400 in surety tokens Sign up and complete the airdrop procedure to receive you"
"Bitcoin Empire","Wed","0.00254914262848","0.000119588615164","0.0","RT"
"Pipitnurul -OLXAcoin.com","Tue","0.000710400600728","0.0887347524516","0.675","RT HappyMonday From everyone at SprintX we want to wish YOU an excellent week full of achievements and opportunities in"
"frank ikeme","Mon","6.52106253798e-05","0.281033245635","0.5","RT Get More Tokens Send a minimum of 0 001ETH to 0xd506e5e57e22c695bf28c96e73c296051177a678 and get 444 444 tokens The more yo"
"Rachidou Mba","Sun","6.32345458228e-05","0.00119588615164","0.21111111111111114","RT Singer has enjoyed success as a member of the hip hop group the Black Eyed Peas and as a solo artist"
"Airdrop Alive","Sat","0.00116193477949","0.0","0.2799242424242424","HOT AND NEW AIRDROP SOCIAL GOOD SG JAPAN Reward 1 token Rate Referral Bonus 0 3 t"
"Geometry of crypto","Fri","0.00314097845579","0.0120784501315","0.7","RT Good Friday Autobayers MVP mvpbuzz f1jp eth ethereum howdoo btc btcc btcp btcpeek bitcoin Blockchain ripple"
"Robert Marchini","Thu","0.00136053077497","0.000837120306147","0.0","RT This shows how concentrated the bitcoin mkt is There are some 1600 bitcoin whales who hold about a 1 3 of the cryptocu"
"HighFrequency","Wed","0.00185751478355","0.0","0.0","How to Solve Blockchain s Data Storage Issues Once and For All in Bitcoin News"
"CryptoAgent47","Tue","0.00215590279665","0.0","0.35","Yep Atomic Swaps are only good for trading your shitcoins for Bitcoin"
"Angelica Fink","Mon","0.0100404602289","0.0167424061229","0.5071428571428571","RT Horizon has a great partnership with Treehouse on our software and Smart Contract needs ico c"
"Geometry of crypto","Sun","0.00314097845579","0.021884716575","0.09999999999999999","RT Hi Decoin Community Our presale stage 2 is open Dtep coin price of 65 for only 14 days We already sold 2 6m worth of dt"
"World Trade Stocks","Sat","0.00183478986864","0.00621860798852","0.0","RT The urge for humans to mine Bitcoin as the difficulty rises is irresistible and will never stop not even after every fiat"
"Cryptozaur","Fri","2.17368751266e-05","0.00107629753647","0.06818181818181818","RT Talking bitcoin with and at his new bar Big things coming"
"علي اليافعي","Thu","0.0","0.00872996890696","0.5","RT Coinbase acquired a securities dealer to let customers trade their ERC20 tokens More than 13 billion has been raised"
"Bobbidazzler","Wed","0.000129433210981","0.000837120306147","0.0","RT DIG crypto bitcoin altcoins price target 0 40 by July August This is my Feb 8 recomme"
"Shaun M.®","Tue","0.0019928762332","0.00633819660368","0.0","RT Looking forward to discussing the importance of CyberSecurity in blockchaintechnology at the in NYC next wee"
"Manhar Gupta","Mon","5.63182673734e-05","0.642549629275","0.0","RT iF Bitcoin goes To 500 000 by 2020 i will give everyone that retweets this tweet 10 000"
"Danny Kass","Sun","0.000962350744241","0.0","0.13636363636363635","Humanitarian project token hmq Is Added to a New Cryptocurrency Exchange cryptocurrency"
"Andi","Sat","1.08684375633e-05","0.281033245635","0.5","RT Get More Tokens Send a minimum of 0 001ETH to 0xd506e5e57e22c695bf28c96e73c296051177a678 and get 444 444 tokens The more yo"
"Acorn Collective","Fri","0.053760232387","0.000239177230328","0.0","Featuring in CrowdfundingForEveryone Crowdfunding Startup Blockchain"
"cryptoaddict","Thu","0.00296016717633","0.021884716575","0.09999999999999999","RT Hi Decoin Community Our presale stage 2 is open Dtep coin price of 65 for only 14 days We already sold 2 6m worth of dt"
"BitSat","Wed","0.00270821703282","0.0","0.25","The most crucial part of the Exchange the Profit Cryptoshare holders receive guaranteed rights to"
"The Laughing Man","Tue","0.00105720256298","0.00872996890696","0.5","RT Coinbase acquired a securities dealer to let customers trade their ERC20 tokens More than 13 billion has been raised"
"PAVEL DZIATLAU","Mon","0.00244243433241","0.0206888304233","0.0","RT Mass adoption of Blockchain based Solutions and cryptocurrencies can reduce transaction fees and third party commissions"
"Ahmed Gitey","Sun","0.000283567416424","0.00334848122459","0.2857142857142857","RT When I started buying Bitcoin at 3 in 2011 told me to wait She was right She started buying at 1"
"Joy Hasan 💯🔥 👍✌️","Sat","0.011605515238","0.0344415211672","-0.5","RT Ask a Ninja featuring our fav FairNinja Yoshi answering random questions posted by his fans ico cryptocurrency"
"Jaafar Kapur","Fri","0.000166978722563","0.00119588615164","0.21111111111111114","RT Singer has enjoyed success as a member of the hip hop group the Black Eyed Peas and as a solo artist"
"James Hunt","Thu","0.00177748356149","0.00239177230328","0.0","RT Chinese Cryptomining Chip Giant Bitmain Is Considering an IPO mining bitcoin blockchain fi"
"Chuba | TGC","Wed","2.6677074019e-05","0.0","0.14285714285714285","Definitely not what I wanted to see on the BTC chart right now but one must adjust when the data tells them to T"
"CryptoCurrencyAlerts.com","Tue","0.00656750040757","0.000239177230328","0.0","We go UP from here BTC Bitcoin"
"Michael  Harper","Mon","0.000973219181804","0.0271466156422","0.0","RT While you trade on the Exchange your holdings will sync with your Coinnup Wallet automatically cryptocurrency bi"
"Saturn V","Sun","0.000300364092658","0.0","0.0","BITCOIN crypto cryptocurrency All Time Highs in Venezuela"
"Charlie Shrem","Sat","0.149030979987","0.00107629753647","0.06818181818181818","Talking bitcoin with and at his new bar Big things coming"
"TheButcherOfCrypto","Fri","0.000346801962247","0.0","-0.25","The past couple weeks of crypto BTC Bitcoin LTC ETH EOS ADA TRX BCH"
"Latifa Bouri","Thu","0.000269734859525","0.00119588615164","0.21111111111111114","RT Singer has enjoyed success as a member of the hip hop group the Black Eyed Peas and as a solo artist"
